id,name,description,dob,owner,gender,image
210,Juan,Training trip although black move into eat modern.,2015-03-07,Thomas Walker,Male,https://example.com/dogs/210.jpg
211,Jason,South before country southern prove.,2009-10-13,Amanda Vega,Female,https://example.com/dogs/211.jpg
212,Michael,Good sea choice including policy really sport.,2013-04-29,Alexander Gillespie,Female,https://example.com/dogs/212.jpg
213,Taylor,Drive move including stand interest tough vote energy state field.,2018-09-06,Taylor Mann,Male,https://example.com/dogs/213.jpg
214,Barbara,Network rather floor least animal behavior image they reason position.,2014-11-01,Kelly Palmer,Male,https://example.com/dogs/214.jpg
215,Lisa,Fact job your according agreement.,2009-11-22,Kiara Morales,Female,https://example.com/dogs/215.jpg
216,Lauren,Whether specific maybe respond yard rich.,2015-06-24,Mr. Eric Cooley,Male,https://example.com/dogs/216.jpg
217,Ronald,Middle life exactly relationship career.,2020-03-08,Scott Washington,Female,https://example.com/dogs/217.jpg
218,Tyler,Security east music night thousand whether movie life word.,2015-05-06,Sarah Doyle,Female,https://example.com/dogs/218.jpg
219,Jane,Either politics investment early speak writer effect well sure.,2023-04-10,Riley Smith,Female,https://example.com/dogs/219.jpg
220,Victoria,Quite program direction agreement prepare.,2012-06-22,Andrea Hill,Female,https://example.com/dogs/220.jpg
221,Evelyn,Even window brother point tree director simple be test.,2020-09-17,Julia Ramsey,Female,https://example.com/dogs/221.jpg
222,Leah,Couple too resource today design number perhaps.,2015-04-18,Steven Romero,Male,https://example.com/dogs/222.jpg
223,Christine,Term here hold candidate vote.,2020-05-08,Daniel Ross,Female,https://example.com/dogs/223.jpg
224,Carol,Heavy after member admit all treat catch discussion allow.,2023-06-13,Ariel Warner,Male,https://example.com/dogs/224.jpg
225,Victor,Often young save line.,2021-12-16,Matthew Harding,Female,https://example.com/dogs/225.jpg
226,Scott,Hope include firm perhaps remain bill color.,2020-06-01,Ronnie Anderson,Male,https://example.com/dogs/226.jpg
227,Ann,Sit eat like phone order three authority age animal.,2013-10-20,Nicole Ortiz,Female,https://example.com/dogs/227.jpg
228,Rebecca,Decade from study data game or high may several person.,2011-08-22,Luis Smith,Male,https://example.com/dogs/228.jpg
229,John,Picture remain soldier interview have miss something site value.,2010-10-06,Deborah Campbell,Female,https://example.com/dogs/229.jpg
230,Edward,Available want debate base know cost record society despite return.,2015-03-28,Scott Torres,Female,https://example.com/dogs/230.jpg
231,Rebecca,Letter Mrs seat career public believe life.,2013-07-19,Jeffery Hunter,Female,https://example.com/dogs/231.jpg
232,Erin,Development market as character yes wonder.,2014-10-26,Thomas Evans,Female,https://example.com/dogs/232.jpg
233,Alex,Do record arm attorney.,2014-08-31,Steven Mccarty,Female,https://example.com/dogs/233.jpg
234,James,Class also now sell I cultural accept fine.,2019-03-16,Javier Torres,Female,https://example.com/dogs/234.jpg
235,Leroy,Notice nor from order yeah buy administration church.,2017-11-10,William Anderson,Female,https://example.com/dogs/235.jpg
236,Scott,Identify weight fear black keep morning sit drug car American.,2017-07-02,Joshua Young,Male,https://example.com/dogs/236.jpg
237,Kenneth,Participant teach forward sense five protect avoid how.,2021-05-26,Jesse Chapman,Female,https://example.com/dogs/237.jpg
238,Charles,Like within already however plant book add no save effect.,2018-11-05,Robert Lowe,Female,https://example.com/dogs/238.jpg
239,Christina,Avoid from truth have today.,2021-03-27,Andrew Knapp,Male,https://example.com/dogs/239.jpg
240,Gregory,Light what interview concern just from sell moment number guy.,2014-03-29,Chelsea Maldonado,Male,https://example.com/dogs/240.jpg
241,Jason,Kind I nor skin since standard history contain firm.,2023-01-28,Sherry Best,Female,https://example.com/dogs/241.jpg
242,Benjamin,Director manage star late baby set since.,2018-11-01,Michelle Camacho,Female,https://example.com/dogs/242.jpg
243,Cassandra,List both whatever piece material since.,2010-04-20,Breanna Chambers,Male,https://example.com/dogs/243.jpg
244,Patricia,Reflect technology letter measure determine system guy design.,2011-05-24,Katherine Arroyo,Male,https://example.com/dogs/244.jpg
245,Colin,Order score father data and new difference.,2015-06-15,Carl Serrano,Female,https://example.com/dogs/245.jpg
246,Steven,Likely your fund order husband truth trial ahead.,2019-07-04,Allison Miller,Female,https://example.com/dogs/246.jpg
247,Joan,Upon today election police theory activity put sit.,2020-01-09,Megan Montoya,Female,https://example.com/dogs/247.jpg
248,Sean,Great create thank front life religious read my.,2011-10-26,Amy Henderson,Male,https://example.com/dogs/248.jpg
249,Eric,Force fly any at leader over they.,2018-05-24,Maria Hernandez,Female,https://example.com/dogs/249.jpg
250,Ricardo,Wrong throw difference against the pick increase grow might hard.,2024-01-31,Laura Perez,Female,https://example.com/dogs/250.jpg
251,Sherry,Throughout area mother especially common fund.,2013-01-18,Lori Collins,Female,https://example.com/dogs/251.jpg
252,Heidi,Really someone southern indeed career of enter.,2020-07-01,Matthew Harris,Male,https://example.com/dogs/252.jpg
253,Brittany,Attention cover evening again in reduce.,2013-04-11,Angela Walsh,Female,https://example.com/dogs/253.jpg
254,Judy,Fish model add price then.,2015-09-20,Edward Trevino,Female,https://example.com/dogs/254.jpg
255,Arthur,Maintain say imagine goal trouble product management country stay.,2017-06-17,Julie Watson,Male,https://example.com/dogs/255.jpg
256,Kathryn,Fact he either to visit doctor receive top them.,2021-12-11,Jessica Armstrong,Male,https://example.com/dogs/256.jpg
257,Kevin,Move challenge phone art run.,2018-10-12,Jeffrey Rowland,Female,https://example.com/dogs/257.jpg
258,Jeffery,Turn city no beautiful enough identify play.,2013-01-14,Heather Byrd,Female,https://example.com/dogs/258.jpg
259,Sylvia,Bed thing air describe art Mrs finish.,2012-06-25,Angelica Schroeder,Female,https://example.com/dogs/259.jpg
260,Maria,Avoid small movement eye very bed start will.,2013-08-25,Shaun Williams,Male,https://example.com/dogs/260.jpg
261,Richard,Lay agent series clear pay.,2022-03-21,Deborah Parks,Female,https://example.com/dogs/261.jpg
262,Jason,Other throw stand fish stock he edge too.,2012-11-01,Brent Lucas,Male,https://example.com/dogs/262.jpg
263,Chelsea,On foreign from value state morning item plan public.,2022-10-07,Ian Daniel,Male,https://example.com/dogs/263.jpg
264,Nathan,Ahead final actually middle family his throughout ready building pressure.,2013-02-14,Terri Zimmerman,Female,https://example.com/dogs/264.jpg
265,Charles,Recently certain nothing memory message outside.,2011-04-20,Brittany Roberts,Male,https://example.com/dogs/265.jpg
266,Gregory,Now audience material image once side.,2024-08-07,Anna Medina,Male,https://example.com/dogs/266.jpg
267,Stanley,Might husband rock house use serious strong those law idea.,2016-08-07,Richard Young,Female,https://example.com/dogs/267.jpg
268,Carolyn,Necessary focus home form eat.,2010-08-24,Melissa Brown,Male,https://example.com/dogs/268.jpg
269,Robert,Level gun low everything certain outside follow account across.,2018-04-27,Joseph Peterson,Male,https://example.com/dogs/269.jpg
270,Victoria,Culture I data market employee.,2021-01-09,Megan Castro,Female,https://example.com/dogs/270.jpg
271,Christopher,Report cold somebody me.,2012-02-27,Matthew Keller,Female,https://example.com/dogs/271.jpg
272,Kimberly,Institution easy wish pressure none.,2021-11-04,Michele Tran,Female,https://example.com/dogs/272.jpg
273,Melissa,Board set foot choice week.,2011-12-16,Katelyn Allen,Male,https://example.com/dogs/273.jpg
274,Joanna,Vote then American evidence ready forward safe.,2022-10-04,Erika Johnson,Female,https://example.com/dogs/274.jpg
275,Scott,Public inside want smile pressure hope.,2024-01-08,Brandy Cross,Female,https://example.com/dogs/275.jpg
276,Vanessa,Admit way ever bit respond in test goal man.,2020-01-12,Jesse Burton,Male,https://example.com/dogs/276.jpg
277,Steven,When player customer offer edge.,2021-10-13,David Jones,Female,https://example.com/dogs/277.jpg
278,Steven,Treat up improve policy too list rest most number clear.,2024-05-25,Frank Burgess,Female,https://example.com/dogs/278.jpg
279,Chad,Say inside model from give instead society save possible.,2011-02-28,Tracy Compton,Male,https://example.com/dogs/279.jpg
280,Madison,Experience left need door instead character.,2010-12-08,Deborah Cannon,Male,https://example.com/dogs/280.jpg
281,Sheena,Public now try southern what ten project live change however.,2011-11-19,Rodney Rodriguez,Female,https://example.com/dogs/281.jpg
282,Joseph,Term truth enter seven most blue blue analysis fly listen.,2016-11-18,Anthony Jefferson,Male,https://example.com/dogs/282.jpg
283,Susan,Resource effort decision effect every cause feel bad.,2013-09-11,James Curtis,Male,https://example.com/dogs/283.jpg
284,Jessica,List fish trouble store consider size.,2021-03-11,Rebecca Page,Male,https://example.com/dogs/284.jpg
285,Brian,Whose hot ask scene three enjoy.,2023-11-24,John Schultz,Female,https://example.com/dogs/285.jpg
286,Cassandra,Strong however point even art would artist century.,2013-09-25,Marie Carroll,Male,https://example.com/dogs/286.jpg
287,Bradley,Raise popular drop coach send method right a hard.,2020-02-29,Matthew Bullock,Female,https://example.com/dogs/287.jpg
288,Vanessa,Tend word recent represent picture attention.,2020-04-04,Regina Ramirez,Male,https://example.com/dogs/288.jpg
289,Bethany,Appear within official short end nice TV.,2011-01-20,Christopher Johnson,Female,https://example.com/dogs/289.jpg
290,Albert,Provide degree must life thing guy past policy be most.,2018-10-14,Courtney Carpenter,Female,https://example.com/dogs/290.jpg
291,Brian,Down save shake lot race whether available herself.,2010-12-01,Elizabeth Olsen,Male,https://example.com/dogs/291.jpg
292,Sylvia,Truth product myself for perform camera never direction explain.,2023-07-16,Jennifer Clements,Female,https://example.com/dogs/292.jpg
293,John,Themselves she design become measure night memory while job hope.,2017-11-20,Alan Dean,Male,https://example.com/dogs/293.jpg
294,Brent,Enjoy technology partner hard need tell key.,2016-11-12,Mrs. Erin Hudson,Male,https://example.com/dogs/294.jpg
295,Kathryn,Wind moment heart everybody response base clearly above Congress standard.,2018-07-09,Michelle Gomez,Male,https://example.com/dogs/295.jpg
296,Gabriela,Five product industry course than report staff position coach leg instead.,2017-01-22,Maria Hernandez,Female,https://example.com/dogs/296.jpg
297,Richard,Third recently pretty also imagine exactly.,2016-05-06,Kristi Williams,Female,https://example.com/dogs/297.jpg
298,Crystal,Officer history cost own wish important picture.,2020-09-07,Angela Goodman,Female,https://example.com/dogs/298.jpg
299,John,Vote think human set face already price majority relationship stage.,2022-11-02,Lisa Carlson,Female,https://example.com/dogs/299.jpg
300,Donna,Ask live lead choice beat option his under.,2023-03-31,Mrs. Amy Johnson,Male,https://example.com/dogs/300.jpg
301,Albert,Describe necessary little speech investment ok change.,2017-09-09,Brianna Livingston,Female,https://example.com/dogs/301.jpg
302,Ryan,Husband threat often Congress field center game board forward easy.,2023-03-11,Carlos Jordan,Male,https://example.com/dogs/302.jpg
303,Thomas,Popular police single station air decision.,2023-01-15,Diana Scott,Male,https://example.com/dogs/303.jpg
304,Candice,Crime as stage officer race dog kitchen ball particularly right.,2017-03-02,Pamela Coleman,Female,https://example.com/dogs/304.jpg
305,Elizabeth,Speak organization anyone travel lot similar everybody leave.,2023-07-25,Traci Oconnell,Male,https://example.com/dogs/305.jpg
306,Theresa,Become product main task field rate.,2010-08-09,Benjamin Lee,Female,https://example.com/dogs/306.jpg
307,Kyle,Respond official resource choice other.,2020-10-30,Caleb Harris,Male,https://example.com/dogs/307.jpg
308,Greg,Generation church very wall often describe produce risk yes.,2019-01-18,Cynthia Rowe,Male,https://example.com/dogs/308.jpg
309,Yolanda,Attack protect yard us coach.,2014-09-15,Jessica Cole,Female,https://example.com/dogs/309.jpg
310,Ruth,Probably writer health impact foot financial.,2019-11-01,Katherine Cortez,Female,https://example.com/dogs/310.jpg
311,Michael,To design quite even provide within summer still value cup.,2016-05-23,Jeffrey Valenzuela,Female,https://example.com/dogs/311.jpg
312,Julie,Experience top practice compare despite tonight baby baby.,2019-10-08,Gregory Lawrence,Female,https://example.com/dogs/312.jpg
313,Daniel,Still feeling billion discussion side remember someone enjoy kind road.,2015-03-06,Matthew Cole,Male,https://example.com/dogs/313.jpg
314,Stacey,Fast produce safe better former data never themselves.,2021-07-30,Caroline Ross,Female,https://example.com/dogs/314.jpg
315,John,Despite response possible garden soon rest while huge vote sound.,2010-01-22,Linda Smith,Female,https://example.com/dogs/315.jpg
316,Lindsey,Purpose these political clearly really hospital moment tax doctor.,2012-05-03,Cynthia Valdez,Male,https://example.com/dogs/316.jpg
317,Christopher,Stuff life remain voice car glass on.,2023-09-11,Kristina Williamson,Female,https://example.com/dogs/317.jpg
318,Kenneth,Case effect degree future tonight now wish theory material business employee.,2023-09-29,John Robinson,Female,https://example.com/dogs/318.jpg
319,Theresa,Product food water goal remain.,2011-04-28,Kari Neal,Female,https://example.com/dogs/319.jpg
320,Melissa,Really name foot enter simple dinner.,2023-11-01,Michelle Kennedy MD,Male,https://example.com/dogs/320.jpg
321,Adam,Adult card model could history must arm physical energy fight peace.,2023-03-07,Betty Davidson,Male,https://example.com/dogs/321.jpg
322,Pamela,Lead think bank happy just sound teacher worker program magazine.,2022-07-13,Jonathan Lindsey,Female,https://example.com/dogs/322.jpg
323,Paul,Alone adult approach pretty agree just left.,2021-09-17,David Bradford,Male,https://example.com/dogs/323.jpg
324,Todd,Laugh outside floor whole part student us.,2015-02-11,Richard Horton,Male,https://example.com/dogs/324.jpg
325,Jasmine,Investment yet brother green arm why successful.,2014-11-11,Bryan Nguyen,Female,https://example.com/dogs/325.jpg
326,Jeffrey,These foot similar whole avoid walk focus.,2012-01-30,Jessica Leon,Male,https://example.com/dogs/326.jpg
327,Christopher,Strategy story support according job case message street.,2019-05-10,Nicholas Ho,Male,https://example.com/dogs/327.jpg
328,David,This let life between those.,2018-05-30,Martin Bowman,Male,https://example.com/dogs/328.jpg
329,Tamara,Chance smile space certainly determine model.,2020-11-26,Kelsey Williams,Male,https://example.com/dogs/329.jpg
330,Scott,Win nation better community staff practice stop structure able president.,2011-09-06,Megan Patterson,Male,https://example.com/dogs/330.jpg
331,Anthony,Sister store would team run organization worker friend across.,2014-09-09,Chad Johnson,Male,https://example.com/dogs/331.jpg
332,Brett,East keep computer current draw.,2013-12-20,Melinda Sanders,Female,https://example.com/dogs/332.jpg
333,Anthony,Course everybody debate person.,2014-09-11,Amanda Smith,Female,https://example.com/dogs/333.jpg
334,Lance,Wall seek get population station scientist respond use.,2017-05-22,Mrs. Taylor Coleman DDS,Female,https://example.com/dogs/334.jpg
335,Jason,Best recognize his guess within public summer cost another night.,2018-11-22,Joseph Hamilton,Male,https://example.com/dogs/335.jpg
336,Lindsey,Say building rather tonight southern set benefit.,2022-10-26,Vanessa Small,Female,https://example.com/dogs/336.jpg
337,Jackson,Point poor court often against successful world address.,2023-06-05,Justin Oliver,Female,https://example.com/dogs/337.jpg
338,Wyatt,Guess ever future indicate improve one.,2022-03-10,Courtney Jackson,Male,https://example.com/dogs/338.jpg
339,Thomas,Music them son Congress about develop age later attention they author.,2018-09-14,Phillip Mccormick,Female,https://example.com/dogs/339.jpg
340,Mark,Protect majority fine less interview effort.,2023-08-21,Jonathan Miller,Female,https://example.com/dogs/340.jpg
341,Daniel,Who already do poor quickly us.,2015-06-15,Brian Johnson,Male,https://example.com/dogs/341.jpg
342,Cindy,Property available member ago contain difficult election.,2019-01-01,Kelly Hopkins,Female,https://example.com/dogs/342.jpg
343,Chad,Tax him probably reason store trade career none well discuss.,2022-05-07,Lisa Lopez,Male,https://example.com/dogs/343.jpg
344,Debra,Protect draw sure art animal woman pass.,2022-12-07,Steven Watson,Male,https://example.com/dogs/344.jpg
345,Aaron,Ask up include rate senior produce particular society enter you.,2021-08-05,Suzanne Phillips,Male,https://example.com/dogs/345.jpg
346,Elizabeth,Item approach east usually accept event either tell expert.,2019-11-27,Jessica Nelson,Female,https://example.com/dogs/346.jpg
347,Robert,Goal thus look share big current represent ready allow.,2023-02-24,Jason Jackson,Female,https://example.com/dogs/347.jpg
348,Teresa,Strategy fight power level lose room.,2015-10-10,Daniel Franklin,Male,https://example.com/dogs/348.jpg
349,Cory,Surface yard herself several civil.,2024-06-18,Anthony Burnett,Male,https://example.com/dogs/349.jpg
350,Abigail,Place source fear choice similar final where hour sing.,2016-08-05,Diane Schultz,Female,https://example.com/dogs/350.jpg
351,Briana,War gun everyone think create court environment join work.,2011-10-16,Kathy Gibbs,Female,https://example.com/dogs/351.jpg
352,Tonya,Service song position system.,2016-11-21,Francisco Garza,Female,https://example.com/dogs/352.jpg
353,Justin,Product while media dream marriage there military close explain.,2010-01-26,Craig Arnold,Male,https://example.com/dogs/353.jpg
354,Tanya,Everybody day land face else floor manage against usually when.,2021-01-26,Russell Jordan,Female,https://example.com/dogs/354.jpg
355,Jennifer,Event allow prepare give spring better throughout admit bank.,2014-09-19,Melissa Kim,Female,https://example.com/dogs/355.jpg
356,Kellie,Action government despite long red against attorney certainly economic.,2018-03-17,Taylor Allen,Male,https://example.com/dogs/356.jpg
357,Shannon,Not inside difficult board national want cause detail.,2016-05-21,Jennifer Henderson,Male,https://example.com/dogs/357.jpg
358,Travis,During west industry last evidence animal.,2020-07-23,Don Jones,Female,https://example.com/dogs/358.jpg
359,Cody,Affect remember add yourself politics form.,2023-01-08,Brandon Price,Female,https://example.com/dogs/359.jpg
360,Clarence,Truth interview story include stage only.,2012-07-23,Jennifer Hernandez,Male,https://example.com/dogs/360.jpg
361,Thomas,Tree policy artist message close join.,2013-04-06,Brandon Owen,Male,https://example.com/dogs/361.jpg
362,Edward,Again career budget me total speak hospital answer.,2017-04-02,Karen Wilson,Male,https://example.com/dogs/362.jpg
363,Amanda,Husband account us guy how treat administration.,2022-10-13,Ryan Becker,Female,https://example.com/dogs/363.jpg
364,Pamela,Shoulder clearly anyone produce show later.,2023-08-26,Jennifer Powell,Male,https://example.com/dogs/364.jpg
365,Paul,Huge north two method culture hair.,2014-08-17,Ryan Thomas,Male,https://example.com/dogs/365.jpg
366,Sean,Writer kind federal paper difficult fast tax.,2024-06-18,John Richardson,Female,https://example.com/dogs/366.jpg
367,James,Federal fine them project card industry practice.,2014-04-24,James Austin,Female,https://example.com/dogs/367.jpg
368,Bethany,Finish turn sign use both fly likely more our today.,2021-12-03,Jessica Jenkins,Male,https://example.com/dogs/368.jpg
369,Aaron,Same mouth chair fast government gas director.,2017-04-05,Kimberly Saunders,Male,https://example.com/dogs/369.jpg
370,Nicole,Remain bill computer large move stand write why game.,2010-02-07,Cristina Day,Female,https://example.com/dogs/370.jpg
371,Martha,Society exactly wait woman threat and take.,2018-03-23,Brandy Fox DDS,Female,https://example.com/dogs/371.jpg
372,David,Dream card our else case else.,2024-08-30,Robin Rios,Female,https://example.com/dogs/372.jpg
373,Kara,Human itself else city house great.,2024-06-25,Charles Peterson,Female,https://example.com/dogs/373.jpg
374,Caleb,Other try camera produce no.,2015-09-11,Nicole Watkins,Male,https://example.com/dogs/374.jpg
375,Mia,This right improve adult standard ago candidate man away far.,2012-01-18,Angela Miller,Male,https://example.com/dogs/375.jpg
376,Madeline,Purpose notice organization long why dinner consumer tend theory.,2016-01-03,Terry Kim,Female,https://example.com/dogs/376.jpg
377,Erica,Once evidence it dinner face low soon.,2020-01-15,Michele Middleton,Male,https://example.com/dogs/377.jpg
378,Kim,Page clear image process movie often decade box decision.,2022-06-12,Kara Rodgers,Female,https://example.com/dogs/378.jpg
379,Peter,Positive down activity various beautiful third management.,2015-04-26,Jessica Rodriguez,Female,https://example.com/dogs/379.jpg
380,Jamie,Statement end produce wish analysis far article.,2023-08-21,Kayla Thomas,Female,https://example.com/dogs/380.jpg
381,Candace,Cover loss begin note recent value painting short.,2017-12-06,Calvin Moore,Male,https://example.com/dogs/381.jpg
382,Eugene,Answer big race my pretty while certain alone.,2011-05-01,Meghan Maddox,Male,https://example.com/dogs/382.jpg
383,Russell,First run military bar wish total alone follow.,2019-04-01,Benjamin Friedman,Male,https://example.com/dogs/383.jpg
384,Ann,Foreign piece thing own hair.,2016-04-04,Annette Young,Female,https://example.com/dogs/384.jpg
385,Jonathan,Up business model occur hope civil.,2017-05-14,Shannon Kim,Male,https://example.com/dogs/385.jpg
386,Pamela,Cell tree social company minute form between film scene appear.,2012-05-20,Jennifer Perry,Female,https://example.com/dogs/386.jpg
387,Kenneth,These realize voice suffer budget onto character here at leave.,2016-01-03,Tyler Cole,Male,https://example.com/dogs/387.jpg
388,Misty,Brother in whole reduce general present cause role.,2020-02-21,Tara Norman,Female,https://example.com/dogs/388.jpg
389,Alyssa,Business important until go interesting.,2024-05-18,Jessica Lowery,Male,https://example.com/dogs/389.jpg
390,Jerry,Three the dinner role society voice then close.,2024-05-15,Andrew Taylor,Female,https://example.com/dogs/390.jpg
391,Amber,Animal final social likely follow simple.,2018-02-22,Jerry Short,Male,https://example.com/dogs/391.jpg
392,Samantha,Common member themselves son skill baby go light democratic particular.,2018-05-08,Paige Mata,Male,https://example.com/dogs/392.jpg
393,Sean,Let focus manager look image direction.,2017-10-22,Laura Mckinney,Female,https://example.com/dogs/393.jpg
394,Julia,At we then forward eat choice follow laugh such production doctor.,2013-04-05,Mary Dean,Female,https://example.com/dogs/394.jpg
395,Lori,Present identify record show sell.,2010-07-16,Karen Winters,Male,https://example.com/dogs/395.jpg
396,Ricky,Have who term significant word true western information wall tree.,2021-06-08,Dawn Fox DVM,Female,https://example.com/dogs/396.jpg
397,Cory,Develop although step among push support couple professional check new.,2010-05-06,Michael Davenport,Female,https://example.com/dogs/397.jpg
398,Darryl,Get write similar language avoid.,2014-10-18,Chad Wilkins,Female,https://example.com/dogs/398.jpg
399,Dwayne,Before care scene treatment nor candidate.,2020-04-12,Crystal Chase DDS,Male,https://example.com/dogs/399.jpg
400,Cameron,Reflect worry couple single either ten operation public head.,2009-12-07,Katherine Patterson,Female,https://example.com/dogs/400.jpg
401,Rebecca,Newspaper surface special tend civil.,2014-02-16,Marilyn Mccarthy,Male,https://example.com/dogs/401.jpg
402,Aaron,Loss wind body while add economy board.,2016-10-24,Mrs. Theresa Thomas,Female,https://example.com/dogs/402.jpg
403,Ryan,Foreign prevent old wrong business just.,2013-05-26,David Guerrero,Female,https://example.com/dogs/403.jpg
404,Stacy,Foreign miss understand compare somebody however when also be structure.,2019-07-14,Kelly Mitchell,Male,https://example.com/dogs/404.jpg
405,Traci,Meeting on method research better model note nothing.,2020-04-04,Joel Schroeder,Female,https://example.com/dogs/405.jpg
406,Nicholas,Any individual front resource difference.,2016-10-14,Carmen Allen,Female,https://example.com/dogs/406.jpg
407,Nicholas,Carry try sit eye phone maintain son.,2023-07-06,Angela Johnson,Female,https://example.com/dogs/407.jpg
408,Michelle,Computer particular benefit society music service stock yet way fight.,2019-06-06,William Summers,Female,https://example.com/dogs/408.jpg
409,Brittney,Continue born fall theory however miss line rock challenge.,2015-10-17,Bobby Lee,Female,https://example.com/dogs/409.jpg
410,Jamie,Eye effect pass fight but stage air write.,2018-10-20,Amanda Buchanan,Male,https://example.com/dogs/410.jpg
411,Robert,Right box will thus rest likely.,2024-02-15,Amanda Simmons,Female,https://example.com/dogs/411.jpg
412,Daniel,Final against pay less voice film different offer provide.,2020-12-31,Carolyn Smith,Female,https://example.com/dogs/412.jpg
413,Joshua,Stage letter total three significant structure discuss culture campaign.,2023-08-10,Hannah Jackson,Male,https://example.com/dogs/413.jpg
414,Jennifer,Out owner learn politics attorney direction.,2013-02-21,Nicholas Peterson,Male,https://example.com/dogs/414.jpg
415,Tyler,Off mouth above address wait.,2024-10-01,Kathy Brown,Female,https://example.com/dogs/415.jpg
