id,name,description,dob,owner,gender,image
416,Mark,Scene happy floor across on control.,2013-11-18,Mary Harvey,Male,https://example.com/dogs/416.jpg
417,Elizabeth,Late across language particular area commercial check opportunity.,2015-04-10,Vanessa Jones,Male,https://example.com/dogs/417.jpg
418,Alexander,Bank similar whose tax price cell chair method still close.,2011-02-05,Julie Davis,Male,https://example.com/dogs/418.jpg
419,Arthur,Parent bit article first end customer skin full nature day.,2017-05-16,Robert Wong,Male,https://example.com/dogs/419.jpg
420,Kimberly,Box theory wait eight though beyond west.,2015-02-02,Christopher Jackson,Female,https://example.com/dogs/420.jpg
421,Bridget,Country necessary yard organization bed cut.,2017-05-29,Karen Guzman,Female,https://example.com/dogs/421.jpg
422,Isaiah,Around personal people single center couple explain wear education so.,2010-07-21,Mrs. Catherine Francis,Male,https://example.com/dogs/422.jpg
423,Laurie,Treat hear series final return check recently.,2012-01-04,Emma Hicks,Male,https://example.com/dogs/423.jpg
424,Shelby,Build become commercial item item fish hand girl.,2016-02-02,Ernest Wood,Male,https://example.com/dogs/424.jpg
425,Jesus,Own fear young commercial can hand suffer day during.,2017-07-10,Jennifer Jackson,Female,https://example.com/dogs/425.jpg
426,Nicole,Politics black there foot guess.,2014-01-23,Teresa Price,Male,https://example.com/dogs/426.jpg
427,Erica,Theory expert thing care newspaper case enter east power relate.,2017-07-06,Tiffany Gibson,Female,https://example.com/dogs/427.jpg
428,Paul,Go see middle ten know their together information.,2010-08-20,Eric Mitchell,Male,https://example.com/dogs/428.jpg
429,Karen,Reason color second social history choose card become.,2010-11-23,Jacob Foley,Male,https://example.com/dogs/429.jpg
430,Kirsten,Or stage Republican win then myself audience radio baby build.,2024-05-23,James King,Female,https://example.com/dogs/430.jpg
431,Jennifer,Moment consumer less high event pick son.,2021-06-02,Rebecca Huynh,Female,https://example.com/dogs/431.jpg
432,Monique,Military increase mother cost alone note.,2012-12-31,Nicholas Jackson,Male,https://example.com/dogs/432.jpg
433,Michelle,We have source soon surface me particularly heart month sit.,2017-01-22,Jordan Garcia,Male,https://example.com/dogs/433.jpg
434,Gary,Knowledge personal answer somebody power.,2014-03-17,Stacey Andrews,Male,https://example.com/dogs/434.jpg
435,Mark,Note yet focus serve me.,2018-01-10,Barbara Sanders,Female,https://example.com/dogs/435.jpg
436,Julie,Safe few job decade message early voice none anything letter.,2017-12-16,Steven White,Female,https://example.com/dogs/436.jpg
437,Mark,Many little traditional dream might a food.,2023-07-20,Brian Evans,Female,https://example.com/dogs/437.jpg
438,Jennifer,Gun property place raise set lay building.,2015-06-04,Robin Mooney DVM,Female,https://example.com/dogs/438.jpg
439,Sarah,System fill matter view quality style go Mrs necessary answer.,2022-07-24,Ryan Mcdowell,Female,https://example.com/dogs/439.jpg
440,Nicholas,True move standard maybe increase quality.,2016-03-08,John Wolfe,Female,https://example.com/dogs/440.jpg
441,Alexandria,They also face seat many Democrat behavior cold factor.,2014-02-26,Melissa Taylor,Male,https://example.com/dogs/441.jpg
442,Kristina,Ago sort common front him strategy citizen right also century.,2019-11-24,John Dorsey,Male,https://example.com/dogs/442.jpg
443,Ronald,Under city across end treatment fact page name firm.,2022-01-18,Chad Barber,Male,https://example.com/dogs/443.jpg
444,Mario,Especially believe enough relate fire story suggest author water budget.,2011-07-10,Jennifer Mathews,Female,https://example.com/dogs/444.jpg
445,Elizabeth,Modern red here just radio maybe small.,2012-05-06,Melissa Powell,Male,https://example.com/dogs/445.jpg
446,Ashley,Social expect many well democratic.,2013-01-04,Timothy Bond,Female,https://example.com/dogs/446.jpg
447,Alex,Break especially some sport not couple business base.,2014-10-14,Steven Campbell,Male,https://example.com/dogs/447.jpg
448,Michele,Cold visit yeah couple training involve start environmental check.,2023-01-25,Martha Moore,Male,https://example.com/dogs/448.jpg
449,Joseph,Light identify fine huge suggest increase serious better.,2017-12-25,Sarah Green,Female,https://example.com/dogs/449.jpg
450,Timothy,Discussion assume room lot sing huge five.,2016-04-29,Jamie Murphy,Male,https://example.com/dogs/450.jpg
451,Melissa,Camera recognize finally activity have end human kid type.,2014-11-21,Maria Bishop,Male,https://example.com/dogs/451.jpg
452,Jessica,Let two success option service change certainly over.,2022-04-16,David Williams,Male,https://example.com/dogs/452.jpg
453,Amanda,Little now middle article usually chair himself happen push.,2021-11-16,Jerry Hart,Male,https://example.com/dogs/453.jpg
454,Monica,Back pull quality reason.,2017-06-01,Erik Jones,Male,https://example.com/dogs/454.jpg
455,Jill,Democrat fly skill join method fast since.,2021-03-10,Jessica Mann,Female,https://example.com/dogs/455.jpg
456,Angel,Energy arrive character program which capital home music follow low.,2016-06-25,Courtney Scott,Female,https://example.com/dogs/456.jpg
457,Cole,Near party team condition reality.,2024-01-27,Maria Clark,Male,https://example.com/dogs/457.jpg
458,Jonathan,Need feeling moment amount figure risk happen act number factor.,2012-03-02,Anita Brewer,Male,https://example.com/dogs/458.jpg
459,Jay,Instead want recently follow institution local all they.,2011-06-02,Amy Martinez,Female,https://example.com/dogs/459.jpg
460,Mary,These level teach condition market.,2016-05-28,Amy Richards,Female,https://example.com/dogs/460.jpg
461,Teresa,Try treat forget public large night continue ever body best indicate.,2010-06-06,Martha Smith,Male,https://example.com/dogs/461.jpg
462,Angela,Those lead go should never officer major future need start.,2016-07-20,Robert Allen,Male,https://example.com/dogs/462.jpg
463,Craig,Anything hour finally his exactly main eye your happy executive.,2022-08-11,Tammy Thompson,Female,https://example.com/dogs/463.jpg
464,Joseph,Group let else catch feeling rule.,2018-11-11,Roger Hernandez,Male,https://example.com/dogs/464.jpg
465,Dana,Set through have imagine.,2020-07-02,Lisa Vang,Female,https://example.com/dogs/465.jpg
466,Olivia,Soon than letter reach each person feeling kid view.,2009-10-18,John Alexander,Female,https://example.com/dogs/466.jpg
467,Christopher,Have prepare than important memory option I old.,2017-03-22,Lori Lane,Male,https://example.com/dogs/467.jpg
468,Cindy,Loss husband far a stock attorney dog believe call.,2017-10-30,Lauren Church,Male,https://example.com/dogs/468.jpg
469,Lisa,Believe expect a significant south.,2016-05-19,Thomas Stone,Female,https://example.com/dogs/469.jpg
470,Michael,Good already who detail theory how hospital.,2023-06-07,Elizabeth Johnson,Male,https://example.com/dogs/470.jpg
471,Rhonda,Character stock with his single pattern.,2023-08-25,Andrew Gonzalez,Male,https://example.com/dogs/471.jpg
472,Kara,System government house large.,2019-09-20,Lynn Lopez,Female,https://example.com/dogs/472.jpg
473,Amber,Against claim race idea get rather.,2012-07-10,Brittany Rubio,Male,https://example.com/dogs/473.jpg
474,David,Television owner all house state.,2012-09-12,David Thomas,Female,https://example.com/dogs/474.jpg
475,Dalton,Age door prove myself individual what painting raise want.,2013-06-24,Michael Thomas,Male,https://example.com/dogs/475.jpg
476,Terry,Reason how pass condition trade government.,2009-12-17,Danielle Mccall,Male,https://example.com/dogs/476.jpg
477,Kevin,Wife forward to strategy others why pick.,2021-06-21,Nicholas Robinson,Female,https://example.com/dogs/477.jpg
478,Alexander,Human care speech onto reach professional tend knowledge feel time drop.,2020-08-19,Collin Murphy,Male,https://example.com/dogs/478.jpg
479,Darrell,Not popular single man soldier.,2019-01-09,William Reed,Female,https://example.com/dogs/479.jpg
480,Samantha,Source key specific enjoy among.,2012-09-23,Elizabeth Rivera,Male,https://example.com/dogs/480.jpg
481,Terri,Two wind authority seat significant point consider.,2014-11-08,Ryan Fernandez,Male,https://example.com/dogs/481.jpg
482,Dylan,Matter meeting box finally rate present listen experience another population.,2018-07-13,Jennifer Dawson,Male,https://example.com/dogs/482.jpg
483,Patrick,South special seat response listen week receive.,2021-11-22,Jennifer Johnson,Male,https://example.com/dogs/483.jpg
484,Matthew,Set more true time necessary improve.,2020-03-12,Michael Lambert,Male,https://example.com/dogs/484.jpg
485,Thomas,Possible again billion carry indicate.,2020-07-04,Christopher Booth,Female,https://example.com/dogs/485.jpg
486,Crystal,Expect fill wall pattern buy structure body establish than.,2017-10-31,Thomas Jackson,Male,https://example.com/dogs/486.jpg
487,Rebecca,Describe reason article safe major indicate.,2017-05-17,Erin Stout,Male,https://example.com/dogs/487.jpg
488,Nicole,Use member offer movie partner hard city occur.,2017-01-31,Haley Acosta,Male,https://example.com/dogs/488.jpg
489,Christopher,Parent change happy generation position way visit happy north several few.,2016-07-16,Dorothy Avery,Female,https://example.com/dogs/489.jpg
490,Donald,Answer wait strong class down born.,2010-05-09,Michael Lambert,Male,https://example.com/dogs/490.jpg
491,Anthony,Wall because thank piece probably environment.,2014-11-23,Raymond Stevenson,Female,https://example.com/dogs/491.jpg
492,Rebecca,Just ground professional rest determine.,2013-12-16,James Mcintosh,Male,https://example.com/dogs/492.jpg
493,Matthew,Partner me cost whom space many.,2024-02-10,Scott Morgan,Male,https://example.com/dogs/493.jpg
494,Dustin,Hot avoid lead free likely finally.,2015-02-26,Sarah Roberts,Female,https://example.com/dogs/494.jpg
495,Crystal,Right it father mention author history act teach.,2009-11-23,Joseph Callahan,Male,https://example.com/dogs/495.jpg
496,Stacy,Surface maybe through discuss group question couple language personal mouth.,2014-06-29,Jose Mccullough,Female,https://example.com/dogs/496.jpg
497,Gregory,True able stay middle door view.,2019-05-05,John Dean,Male,https://example.com/dogs/497.jpg
498,Paul,Growth write share grow themselves deep Congress.,2024-02-27,Leah Peterson,Female,https://example.com/dogs/498.jpg
499,Joseph,Role set stand push health everyone item.,2018-09-12,Taylor Smith,Male,https://example.com/dogs/499.jpg
500,Nicholas,Particular window few my spring.,2023-03-28,Anna Roberts,Female,https://example.com/dogs/500.jpg
501,Christopher,Tree mean blood him quickly local source throughout of work.,2017-06-29,Jon Gamble,Female,https://example.com/dogs/501.jpg
502,Steven,Late call husband money particularly TV during if soon.,2013-01-08,Marissa Callahan,Male,https://example.com/dogs/502.jpg
503,John,Value dark hold side clearly over factor among.,2019-01-28,Brett Dixon,Male,https://example.com/dogs/503.jpg
504,Gina,Impact water section stay measure.,2011-06-18,Katherine Cunningham,Female,https://example.com/dogs/504.jpg
505,Spencer,Many rise simply chair rise beautiful drop.,2015-07-01,Megan Mills,Female,https://example.com/dogs/505.jpg
506,Angel,Light nor direction price truth budget within summer alone defense begin.,2021-11-03,Terry Bowman,Male,https://example.com/dogs/506.jpg
507,Jasmine,Though statement smile structure if instead art seek mind detail.,2021-09-04,Michele Vasquez,Female,https://example.com/dogs/507.jpg
508,Kathleen,Trial off soon energy those girl.,2017-09-23,Robert Sims,Male,https://example.com/dogs/508.jpg
509,Lucas,Professional yourself after film yard adult.,2022-07-30,Joseph Armstrong,Female,https://example.com/dogs/509.jpg
510,Michael,Trial oil arrive account particularly court method get.,2010-06-16,Mrs. Sandra Mathews,Male,https://example.com/dogs/510.jpg
511,Tommy,Especially federal clear yourself law property energy chance ready one.,2019-01-22,Megan Dominguez,Male,https://example.com/dogs/511.jpg
512,Joseph,Cell talk bad cell appear real realize.,2010-01-20,Christopher Holmes,Female,https://example.com/dogs/512.jpg
513,Kenneth,Appear green past far admit foot why.,2013-03-06,Mary Carpenter,Male,https://example.com/dogs/513.jpg
514,Cynthia,Wonder try notice owner accept part.,2011-10-02,Dr. Jason Evans,Male,https://example.com/dogs/514.jpg
515,Carrie,Free education employee month manage practice oil sit.,2014-05-08,Ernest Snyder,Female,https://example.com/dogs/515.jpg
516,Mario,Down staff may dinner far central southern see.,2016-08-05,Deborah Kirby,Female,https://example.com/dogs/516.jpg
517,Brandon,Would administration mother learn interview chair occur home suffer.,2014-11-03,Robin Mason,Male,https://example.com/dogs/517.jpg
518,Cory,Political last central despite dog during state security.,2011-11-25,Neil Wheeler,Male,https://example.com/dogs/518.jpg
519,Roger,Both strategy contain property he country agreement good.,2017-06-28,Stephanie Barnett,Female,https://example.com/dogs/519.jpg
520,James,Front south source room successful ok may try.,2020-08-01,Eric West,Male,https://example.com/dogs/520.jpg
521,Heather,West pretty sort clearly simple.,2011-11-18,Jennifer Cooper PhD,Male,https://example.com/dogs/521.jpg
522,Gerald,White former Mrs now body step force soon herself.,2023-07-01,Kristin Weaver,Male,https://example.com/dogs/522.jpg
523,Oscar,Worry point trade crime arm wind force lead book.,2012-03-22,Casey Smith,Female,https://example.com/dogs/523.jpg
524,Connor,Raise series music pull color direction study goal home.,2015-03-21,Tracy Henson,Female,https://example.com/dogs/524.jpg
525,Melvin,Present partner explain audience view focus meeting goal.,2021-06-07,Michael Jones,Male,https://example.com/dogs/525.jpg
526,Derek,Be TV make seem arm.,2012-01-21,Lisa Miller,Male,https://example.com/dogs/526.jpg
527,Katherine,Behind performance never heavy choice rise garden.,2019-03-14,Brian Morris,Male,https://example.com/dogs/527.jpg
528,Michele,Opportunity top training hand use respond.,2024-08-20,Joel Washington,Female,https://example.com/dogs/528.jpg
529,Jesse,Seat development government star.,2018-06-19,Donna Moody,Male,https://example.com/dogs/529.jpg
530,Sarah,Financial crime body network almost past since cause analysis main.,2014-11-02,Nicole Harmon,Female,https://example.com/dogs/530.jpg
531,Joshua,Present not much together public option pay maintain.,2011-05-28,Felicia Nelson,Female,https://example.com/dogs/531.jpg
532,Leslie,Congress cost win stock Mr school performance still pattern.,2017-10-20,Dr. Lindsay Morales,Female,https://example.com/dogs/532.jpg
533,Jeremy,That decision international few necessary gun resource under.,2009-12-19,Brian Richard,Female,https://example.com/dogs/533.jpg
534,Tony,Call start third majority act company paper account bit message.,2018-10-30,Adrienne Johnson MD,Male,https://example.com/dogs/534.jpg
535,Caitlin,Will sound these fine line school.,2015-04-01,Lori Villarreal,Male,https://example.com/dogs/535.jpg
536,Christy,Contain woman bank few minute rate side peace truth center.,2010-12-25,Zachary Scott,Male,https://example.com/dogs/536.jpg
537,Christine,Stay sense guess whatever actually standard standard.,2023-06-12,Bobby Rosario,Male,https://example.com/dogs/537.jpg
538,Harry,Your respond wear upon wait cut.,2019-07-05,Tracy Hart,Male,https://example.com/dogs/538.jpg
539,Tommy,Of job appear film natural center foreign type chair.,2015-12-26,Ryan Hobbs,Male,https://example.com/dogs/539.jpg
540,Mackenzie,War great on guess.,2018-02-24,Amanda Gonzalez PhD,Female,https://example.com/dogs/540.jpg
541,Stacy,Available lay discussion specific month until bank chance.,2019-04-04,Melissa Allen,Female,https://example.com/dogs/541.jpg
542,Michelle,Would who himself green whether during box.,2011-03-13,Mike Anderson,Male,https://example.com/dogs/542.jpg
543,Elizabeth,Add let call business success team individual play she probably management.,2017-10-25,Patrick Richardson DDS,Male,https://example.com/dogs/543.jpg
544,Kyle,Time meet human protect few set.,2011-05-24,Cristian Patel,Female,https://example.com/dogs/544.jpg
545,Elizabeth,About owner could community every agency.,2016-09-19,James Williams,Male,https://example.com/dogs/545.jpg
546,Samuel,Record important air people door chair choose very budget.,2022-11-20,Joseph Norton,Female,https://example.com/dogs/546.jpg
547,Jose,Money life sport sell share free per might.,2016-10-27,Victor Daniels,Male,https://example.com/dogs/547.jpg
548,Tiffany,She main away field up environmental.,2015-01-16,Sarah Molina MD,Male,https://example.com/dogs/548.jpg
549,Jackie,Reduce simply peace fight third summer really inside.,2020-03-05,Theresa Thompson,Male,https://example.com/dogs/549.jpg
550,Dustin,Cell oil sound increase reality truth city stage career.,2022-10-20,Kristen Terry,Male,https://example.com/dogs/550.jpg
551,Sandra,Be recent participant citizen writer call.,2021-07-21,Christy Koch,Male,https://example.com/dogs/551.jpg
552,Victoria,Them why explain yourself middle until which person.,2021-09-12,Russell Hunter,Male,https://example.com/dogs/552.jpg
553,Michael,Find just country skill product glass adult close analysis.,2022-01-15,Barbara Smith,Male,https://example.com/dogs/553.jpg
554,Brandy,My include also position say have between.,2012-07-01,Natalie Love,Male,https://example.com/dogs/554.jpg
555,Andrew,Company side popular dog while land building.,2010-10-31,Justin Gaines,Male,https://example.com/dogs/555.jpg
556,Stephanie,Democrat whose never table management system.,2016-09-18,Susan West,Female,https://example.com/dogs/556.jpg
557,Julia,Simply financial value free be.,2019-10-31,Michael Rogers,Female,https://example.com/dogs/557.jpg
558,Raymond,Night north hard maintain camera foot catch work factor southern.,2019-10-15,Rebekah Yates,Female,https://example.com/dogs/558.jpg
559,Amy,Simple husband business pay prevent clearly local side new represent.,2018-02-28,Darlene Owen,Female,https://example.com/dogs/559.jpg
560,Elizabeth,Life along two address economic its view.,2013-11-26,William Walker,Female,https://example.com/dogs/560.jpg
561,Harold,Various why already social oil commercial information.,2021-12-03,Jason Shepherd,Female,https://example.com/dogs/561.jpg
562,Larry,Movement walk knowledge wall along behavior around what option resource.,2011-02-14,Rebekah Mathews,Male,https://example.com/dogs/562.jpg
563,Leslie,Such easy early air work heavy carry.,2013-12-24,Sandra Meyer,Male,https://example.com/dogs/563.jpg
564,Michelle,Good laugh main break conference personal compare.,2012-12-12,Jonathan Walker,Male,https://example.com/dogs/564.jpg
565,Shannon,Your history face particularly down.,2016-02-25,David Smith,Male,https://example.com/dogs/565.jpg
566,Selena,Side PM perform focus way.,2009-10-31,James Potter,Female,https://example.com/dogs/566.jpg
567,Rebecca,Say capital wait gas this any attack on important series education.,2023-08-07,Terrence Kim Jr.,Male,https://example.com/dogs/567.jpg
568,Cynthia,Answer of prevent dog true group community always lead.,2017-12-23,Philip Ross,Male,https://example.com/dogs/568.jpg
569,Michael,Road should federal should before song.,2022-10-04,Joyce Robbins,Male,https://example.com/dogs/569.jpg
570,Tonya,Power strong treat name PM forward.,2024-07-05,Michelle Deleon,Female,https://example.com/dogs/570.jpg
571,Monica,Yeah you deep letter goal either operation involve.,2017-07-31,Joshua Reese,Female,https://example.com/dogs/571.jpg
572,Nina,Toward pull red something really act today.,2012-06-08,Kevin Sandoval,Male,https://example.com/dogs/572.jpg
573,Sara,Lose just mouth stay likely traditional at.,2012-03-07,Eugene Rice,Male,https://example.com/dogs/573.jpg
574,Juan,Opportunity major note international identify experience finally big with.,2019-07-08,Sarah Valenzuela,Female,https://example.com/dogs/574.jpg
575,Theresa,Care order picture somebody suggest reach.,2013-05-03,Joseph Perez,Male,https://example.com/dogs/575.jpg
576,Jeffrey,Finish side have single action I consider attention activity.,2018-08-21,David Kirk,Female,https://example.com/dogs/576.jpg
577,William,Character none poor well cut point personal local study.,2016-09-04,Tara Gray,Male,https://example.com/dogs/577.jpg
578,Craig,Present American material pull security.,2010-02-19,Larry Howe,Male,https://example.com/dogs/578.jpg
579,Sarah,Meeting shoulder game next rise across receive apply describe.,2014-01-20,Ralph Smith,Male,https://example.com/dogs/579.jpg
580,Anthony,Light action piece executive answer top.,2020-03-19,Tammy Clayton,Male,https://example.com/dogs/580.jpg
581,Jonathon,Research candidate several production dream from after.,2020-10-19,Juan Rhodes,Male,https://example.com/dogs/581.jpg
582,Rebecca,Mind Republican agent sure city economic spring again radio perform notice.,2024-08-17,Michelle Burke,Male,https://example.com/dogs/582.jpg
583,Kristen,None thank whose thing people.,2022-08-31,Tammy Jones,Male,https://example.com/dogs/583.jpg
584,Heather,Star point energy song by body degree.,2010-10-15,Craig Randolph,Male,https://example.com/dogs/584.jpg
585,Angela,Wear house ask many record final.,2012-07-19,Robert Perry,Male,https://example.com/dogs/585.jpg
586,Suzanne,Yard certainly society thank know open fund leave these generation.,2013-06-09,Cheyenne Moore,Female,https://example.com/dogs/586.jpg
587,Andrew,Else contain career public music discuss.,2020-05-17,David Hardy,Female,https://example.com/dogs/587.jpg
588,Brittney,Claim subject he dog field possible step once.,2012-09-21,Stephanie Douglas,Male,https://example.com/dogs/588.jpg
589,Charles,House teacher point dark write ok recently collection.,2014-12-02,Amber Wilkinson MD,Male,https://example.com/dogs/589.jpg
590,Brandon,Oil ago general be tree us.,2021-10-02,Lisa Bowen,Female,https://example.com/dogs/590.jpg
591,Tracy,Whether fund case air style public role pick take.,2020-07-01,Corey Boyd,Female,https://example.com/dogs/591.jpg
592,Jared,Produce treat early their everyone point rule.,2016-05-12,Jennifer Petersen,Female,https://example.com/dogs/592.jpg
593,Michael,Many training seek radio another base firm.,2019-06-18,James Smith,Female,https://example.com/dogs/593.jpg
594,Diana,Structure parent child other shake girl appear major.,2024-01-07,Debbie Schwartz,Female,https://example.com/dogs/594.jpg
595,Paul,Study establish meeting send answer always carry.,2010-10-25,David Lopez,Male,https://example.com/dogs/595.jpg
596,Kristi,Know adult without physical pressure responsibility.,2021-01-09,Steven Avery,Male,https://example.com/dogs/596.jpg
597,Stanley,Everything whose environmental opportunity her want drug reality.,2022-09-09,Karen Watson,Female,https://example.com/dogs/597.jpg
598,Joshua,Treatment author scene interview be happy.,2023-08-28,Heather Perry,Male,https://example.com/dogs/598.jpg
599,Angela,Institution another write media central short according.,2011-01-16,Connie Porter,Male,https://example.com/dogs/599.jpg
600,James,Who past degree accept crime eight.,2018-01-02,Stephen Tucker,Female,https://example.com/dogs/600.jpg
601,Christie,Member make note down we collection.,2016-12-17,Jennifer West,Male,https://example.com/dogs/601.jpg
602,Kimberly,Stand card human so free college responsibility.,2021-12-10,Joseph Clarke,Male,https://example.com/dogs/602.jpg
603,Abigail,Push require force at development.,2024-09-13,Erin Camacho,Female,https://example.com/dogs/603.jpg
604,Eric,Necessary run once mean large individual guess.,2009-11-06,Debra Williams,Female,https://example.com/dogs/604.jpg
605,Brittany,Will course computer investment cost challenge.,2019-02-17,Jason Mendez,Female,https://example.com/dogs/605.jpg
606,Samantha,Pull field tend improve bill give kitchen resource thank oil.,2019-05-31,Emily Reyes,Male,https://example.com/dogs/606.jpg
607,Christine,Blood million often social put pretty.,2021-08-23,Deanna Huff,Male,https://example.com/dogs/607.jpg
608,Tyler,Example shoulder hope alone administration movement.,2014-07-06,Clinton Evans,Male,https://example.com/dogs/608.jpg
609,Theresa,Author large interest create song product.,2014-07-01,Joseph Ross,Female,https://example.com/dogs/609.jpg
610,Charles,Something point hand he civil how themselves push sit.,2016-03-13,Katherine Jackson,Male,https://example.com/dogs/610.jpg
611,Jacob,Generation into coach fill TV herself.,2011-07-17,Leslie Mitchell,Female,https://example.com/dogs/611.jpg
612,Tyler,Because popular class over visit improve push.,2017-12-10,Debra Smith,Male,https://example.com/dogs/612.jpg
613,Tonya,My audience technology admit draw show outside firm reflect.,2019-01-29,Daniel Cole,Male,https://example.com/dogs/613.jpg
614,Gregory,Cause less middle too western certain Mr information individual.,2013-03-28,Patricia Patterson,Female,https://example.com/dogs/614.jpg
615,Austin,To pull role painting other event herself nature.,2013-03-17,Ryan Perez,Female,https://example.com/dogs/615.jpg
616,Tracy,Else win night lose more tough.,2021-06-28,Matthew Ortiz,Male,https://example.com/dogs/616.jpg
617,Victoria,Ago analysis popular college city.,2019-09-01,Adam George,Female,https://example.com/dogs/617.jpg
618,Stephanie,Performance what less meeting story probably sea kitchen whole.,2012-10-07,Mitchell Bailey,Male,https://example.com/dogs/618.jpg
619,Mark,Consumer tax forget mean run by get.,2022-01-18,Chad Ramsey,Female,https://example.com/dogs/619.jpg
620,Ashley,Choose strong clear here three card toward involve.,2018-07-12,Courtney Rush,Female,https://example.com/dogs/620.jpg
621,Tammy,About human culture artist fact pick month.,2012-09-19,George Nguyen,Male,https://example.com/dogs/621.jpg
622,Ian,Report technology newspaper seek his little figure power.,2013-02-08,Kevin Waller,Female,https://example.com/dogs/622.jpg
623,Jonathon,Important standard blue suddenly option before.,2013-05-05,Katherine Leon,Male,https://example.com/dogs/623.jpg
