id,name,description,dob,owner,gender,image
624,Laura,Probably force line assume produce study our concern.,2013-07-27,Jennifer Gillespie,Male,https://example.com/dogs/624.jpg
625,Ricky,Quickly top market million expert group window where food media.,2024-05-19,Wendy Jones,Female,https://example.com/dogs/625.jpg
626,Tracy,Rate language morning finally.,2015-09-14,Mitchell Berger,Female,https://example.com/dogs/626.jpg
627,Stephen,However him appear learn central.,2022-09-27,Kelli Schneider,Female,https://example.com/dogs/627.jpg
628,Victoria,Enough city difficult particular whether.,2012-01-10,Brittany Herrera,Female,https://example.com/dogs/628.jpg
629,Nancy,Show certainly less themselves find.,2014-03-27,Karen Crawford,Female,https://example.com/dogs/629.jpg
630,Joseph,Growth because approach purpose enter nature wish call break certainly.,2016-09-03,Melissa Ponce,Female,https://example.com/dogs/630.jpg
631,Paul,Risk particularly seven seat song draw parent toward gun.,2023-08-19,Stephanie Johnson,Male,https://example.com/dogs/631.jpg
632,Kimberly,Forward window college first west theory save material spend last.,2018-10-29,Danielle Sims,Female,https://example.com/dogs/632.jpg
633,David,Discover ahead specific career blue during.,2017-03-24,Kathleen Hayes,Female,https://example.com/dogs/633.jpg
634,Deborah,Cultural many trial produce then foreign growth seat newspaper.,2022-10-01,Alexander Payne,Male,https://example.com/dogs/634.jpg
635,Terri,Fine call focus order record school wife general.,2015-09-03,Johnny Harris,Male,https://example.com/dogs/635.jpg
636,Megan,Minute high rise where street by.,2010-02-10,Cory Evans,Male,https://example.com/dogs/636.jpg
637,Donna,Hand author husband range when do suddenly them sister method heart.,2020-02-08,Patrick Palmer,Female,https://example.com/dogs/637.jpg
638,Renee,Medical similar will involve partner present stock sell.,2010-11-26,Sherri Osborn,Male,https://example.com/dogs/638.jpg
639,Lucas,Unit even something space.,2022-07-30,James Fernandez,Female,https://example.com/dogs/639.jpg
640,Bobby,Total life drug recently write size.,2014-08-07,April Nguyen,Male,https://example.com/dogs/640.jpg
641,Renee,Occur many property trip case blue effort yes note customer.,2023-10-24,Colleen Thomas,Male,https://example.com/dogs/641.jpg
642,Daniel,Century mission police point price.,2011-05-28,Kara Meadows,Male,https://example.com/dogs/642.jpg
643,Michelle,Remember require exist newspaper remember measure hold because write.,2016-06-17,Michael Shaw,Male,https://example.com/dogs/643.jpg
644,Alicia,Force movie seat particularly practice cultural.,2016-02-11,Joann Ortiz,Male,https://example.com/dogs/644.jpg
645,Gregory,Have page magazine store what.,2023-04-29,Wanda Brown,Male,https://example.com/dogs/645.jpg
646,Kathryn,That lead certain environmental management society amount.,2017-02-27,Shannon Weaver,Female,https://example.com/dogs/646.jpg
647,Joseph,Choice business buy short take society today stand like will.,2021-04-07,Sean Pearson,Female,https://example.com/dogs/647.jpg
648,Jeremy,Generation popular tend song play focus him.,2012-01-09,Joshua Jones,Male,https://example.com/dogs/648.jpg
649,Dean,Throw thought nothing collection teacher grow body cold seven.,2014-01-16,Jessica Harvey,Male,https://example.com/dogs/649.jpg
650,Jonathan,Half modern too best space hospital ahead democratic.,2018-12-24,Caitlyn Dickson DVM,Female,https://example.com/dogs/650.jpg
651,Reginald,Suddenly air discussion figure television.,2011-04-23,Janice Jimenez MD,Female,https://example.com/dogs/651.jpg
652,Cameron,Tonight society of page give simple community success.,2021-12-29,Michael Gibbs,Male,https://example.com/dogs/652.jpg
653,Nicole,Wish trade open southern current.,2013-04-05,Elizabeth Taylor,Male,https://example.com/dogs/653.jpg
654,Ricky,Fast into dream others behavior learn game picture.,2011-12-27,Nicholas Gallegos,Female,https://example.com/dogs/654.jpg
655,Russell,Why president professor high present challenge live no.,2011-04-14,Sean Bray,Male,https://example.com/dogs/655.jpg
656,Mitchell,Near relationship model sound force eat fire decade more.,2015-02-05,Aaron Torres,Male,https://example.com/dogs/656.jpg
657,Alyssa,Word official TV summer the movement.,2021-05-30,Rebecca Colon,Male,https://example.com/dogs/657.jpg
658,Charles,My floor usually serve laugh between.,2013-01-09,Kayla Webster,Male,https://example.com/dogs/658.jpg
659,Sierra,Road rich structure these keep.,2012-04-14,Audrey Olson,Male,https://example.com/dogs/659.jpg
660,Mary,Write I born television strong animal force year over.,2024-05-16,Stephanie Fisher MD,Female,https://example.com/dogs/660.jpg
661,Crystal,Government during president same someone industry play value rather again.,2013-05-18,Charles Schaefer,Male,https://example.com/dogs/661.jpg
662,Alexis,Claim visit work choice land movement fund specific car.,2017-10-09,Leslie Schneider,Male,https://example.com/dogs/662.jpg
663,Stephen,Partner century give kind always skill.,2021-04-19,Joshua White,Female,https://example.com/dogs/663.jpg
664,Nathan,Family month usually investment garden impact country.,2017-01-11,Heather Davis,Female,https://example.com/dogs/664.jpg
665,Felicia,Vote remember present view today computer kid behind care college.,2022-09-23,Kelsey Barnes,Male,https://example.com/dogs/665.jpg
666,Heather,And general anyone science natural rock growth very.,2024-01-06,Jeffery Schultz,Male,https://example.com/dogs/666.jpg
667,James,Win century executive open where toward everybody wide magazine.,2011-07-31,John Leon,Female,https://example.com/dogs/667.jpg
668,Ryan,Season partner speak actually stand cup never size.,2023-06-02,Laurie Green MD,Female,https://example.com/dogs/668.jpg
669,Penny,Author voice a use save within.,2010-11-30,Cynthia Ruiz,Male,https://example.com/dogs/669.jpg
670,Mary,Place possible government heavy add manager apply visit if painting little.,2012-05-12,Joshua Heath,Female,https://example.com/dogs/670.jpg
671,Michael,Along approach must must.,2023-10-20,Kenneth Valdez,Female,https://example.com/dogs/671.jpg
672,Heidi,Evening read bill garden training seven.,2018-09-16,Lisa Torres,Female,https://example.com/dogs/672.jpg
673,Thomas,Still far action suggest region.,2023-04-03,Danielle Tucker,Female,https://example.com/dogs/673.jpg
674,Melanie,Since red group whole artist base subject.,2023-04-02,Paul Ramirez,Male,https://example.com/dogs/674.jpg
675,Thomas,Responsibility election nice nation act official.,2022-10-27,John Haynes,Male,https://example.com/dogs/675.jpg
676,Zachary,Deep believe point despite either very free.,2019-07-28,Isaiah Williams,Male,https://example.com/dogs/676.jpg
677,Shannon,But face particular poor control.,2022-02-06,Kimberly Guzman,Female,https://example.com/dogs/677.jpg
678,Amber,Say likely hand economy talk pay truth sometimes cold.,2010-10-07,Timothy Mendoza,Male,https://example.com/dogs/678.jpg
679,Katrina,Future shake raise director bring eye technology fight.,2012-02-26,David Henry,Male,https://example.com/dogs/679.jpg
680,Brooke,His store sense mention least throughout such hotel.,2011-07-21,Jacqueline Gonzalez,Female,https://example.com/dogs/680.jpg
681,Ruth,Who small affect computer sport situation body.,2019-03-23,John Wong,Male,https://example.com/dogs/681.jpg
682,Christopher,Cut suffer before tend another until.,2022-10-07,Lisa Smith,Female,https://example.com/dogs/682.jpg
683,Anthony,Especially enjoy better girl authority common until mouth little.,2023-04-13,Bryan Castaneda,Female,https://example.com/dogs/683.jpg
684,Joann,Each three determine research skill.,2023-06-02,April Russo,Female,https://example.com/dogs/684.jpg
685,Jeremy,Student good determine crime less wish particularly.,2011-06-14,Kyle Bryant,Male,https://example.com/dogs/685.jpg
686,Taylor,Data imagine final perform society apply image.,2016-11-07,Bradley Gardner,Female,https://example.com/dogs/686.jpg
687,Megan,Letter up foot world job production small four raise.,2017-01-08,Neil Sanders,Male,https://example.com/dogs/687.jpg
688,Kevin,Couple edge send stuff financial.,2021-02-01,James Edwards,Male,https://example.com/dogs/688.jpg
689,Adam,All interview practice knowledge still safe back.,2012-08-07,Louis Gibbs,Male,https://example.com/dogs/689.jpg
690,Alicia,Teacher around several everyone smile clearly goal treatment economic establish.,2021-10-06,Blake Ortiz,Male,https://example.com/dogs/690.jpg
691,Paul,Against easy sign east onto win meet game range.,2020-02-24,Michael Santos,Male,https://example.com/dogs/691.jpg
692,Brittany,Whose hit into firm thank.,2013-05-08,Paul Griffith,Female,https://example.com/dogs/692.jpg
693,Jason,Space city per much capital tonight cold anything everyone.,2017-12-11,Stephanie Kim,Male,https://example.com/dogs/693.jpg
694,Manuel,Use there century imagine recently person feeling sell customer important.,2013-10-31,Lisa Smith,Female,https://example.com/dogs/694.jpg
695,Jason,Organization often put apply reflect major over understand.,2014-04-23,Mary Richards,Female,https://example.com/dogs/695.jpg
696,Hannah,Important wear think ten seem technology skill laugh stay attorney.,2017-06-01,Martha Pham,Female,https://example.com/dogs/696.jpg
697,Richard,Attack southern may professional upon factor information.,2023-10-26,Ryan Warner,Male,https://example.com/dogs/697.jpg
698,Jordan,Stock pay day pretty never stock hand now.,2011-03-26,Leslie Roberts,Male,https://example.com/dogs/698.jpg
699,Ryan,Involve bring science house hair popular involve foreign.,2012-03-25,Dr. Jessica Miller,Male,https://example.com/dogs/699.jpg
700,Matthew,Current people move peace box lawyer.,2011-10-13,Michelle Hughes,Male,https://example.com/dogs/700.jpg
701,Justin,Where we item generation these newspaper.,2014-11-22,Brandon Cooper,Female,https://example.com/dogs/701.jpg
702,Debra,Happen season hundred couple concern difference education top decade door.,2016-02-15,Daniel Mitchell,Female,https://example.com/dogs/702.jpg
703,Elizabeth,Meeting you high send dog run commercial my.,2016-06-17,Christie Wood,Male,https://example.com/dogs/703.jpg
704,Erin,Read us hope blood least own but one.,2021-09-30,Lisa Brown,Female,https://example.com/dogs/704.jpg
705,Joseph,Call another or radio strong capital morning able.,2013-03-28,Kristy Harvey,Male,https://example.com/dogs/705.jpg
706,Andrew,Debate together trial three suddenly woman test.,2010-03-02,Christina Clark,Male,https://example.com/dogs/706.jpg
707,Valerie,Base what word season cost compare industry today.,2017-04-16,James Miller,Male,https://example.com/dogs/707.jpg
708,Karen,Kid red sport professor nature.,2018-07-01,Nancy Brown,Male,https://example.com/dogs/708.jpg
709,Edward,Run work teacher thus technology pull situation want better have letter.,2024-03-06,Kelly Wang,Female,https://example.com/dogs/709.jpg
710,Melissa,Every in peace radio sea race yard.,2018-02-28,Robert Gill,Male,https://example.com/dogs/710.jpg
711,Blake,Ten record run language indeed it.,2014-10-26,Jeremy Martin,Male,https://example.com/dogs/711.jpg
712,Jessica,Production father generation recognize land alone over.,2012-06-22,Sheila Mcknight,Male,https://example.com/dogs/712.jpg
713,Kelly,For my article himself money least dinner.,2018-04-29,Nathaniel Arnold,Female,https://example.com/dogs/713.jpg
714,Melissa,Benefit near find few movie.,2021-07-10,Rachel Nelson,Male,https://example.com/dogs/714.jpg
715,Brian,Thank issue war physical cost center.,2016-12-27,Trevor Randall,Male,https://example.com/dogs/715.jpg
716,Sherri,Finally mind be alone also.,2012-12-09,Gary Stevens,Female,https://example.com/dogs/716.jpg
717,Laura,Exactly yourself total kind risk.,2024-10-06,Andrew Maldonado,Male,https://example.com/dogs/717.jpg
718,Paul,Car song people technology.,2024-01-25,Cynthia Johnson,Female,https://example.com/dogs/718.jpg
719,Isaiah,Data bar business green dream gas reveal order.,2022-03-20,Jasmine Martinez,Female,https://example.com/dogs/719.jpg
720,Amanda,Certainly between eye free.,2010-10-18,Victoria Bell,Male,https://example.com/dogs/720.jpg
721,Joanna,Leader early young trouble.,2024-03-14,Wendy Franco,Female,https://example.com/dogs/721.jpg
722,Sherri,Right for memory heavy his produce he pattern enough expect.,2020-05-25,Michelle Webb,Male,https://example.com/dogs/722.jpg
723,Sophia,Hold enter still training would.,2014-04-24,David Galvan,Male,https://example.com/dogs/723.jpg
724,Michael,Play will shoulder doctor return cost indeed.,2022-06-02,Isaac Kerr,Female,https://example.com/dogs/724.jpg
725,William,Outside agent board memory me physical walk.,2018-09-02,Wesley Phillips,Female,https://example.com/dogs/725.jpg
726,James,Finish hard strategy quality part instead analysis find apply loss.,2019-04-17,Brittany Kelly,Male,https://example.com/dogs/726.jpg
727,Brian,Condition thought me fact modern however than sport eye ok.,2010-10-12,Pamela Fisher,Male,https://example.com/dogs/727.jpg
728,Elizabeth,Deal million its baby across realize.,2021-06-21,James Lee,Male,https://example.com/dogs/728.jpg
729,Maria,For most challenge specific up improve church maybe.,2012-06-30,Pamela Lee,Female,https://example.com/dogs/729.jpg
730,Laura,Road against worker picture senior seem.,2024-05-29,William Chavez,Female,https://example.com/dogs/730.jpg
731,Clarence,Head risk they word machine trouble teacher hand hear on.,2024-06-25,Dennis Williams,Female,https://example.com/dogs/731.jpg
732,Edward,Guy them determine sing follow list tend ball not property.,2016-10-30,Mary Williams,Female,https://example.com/dogs/732.jpg
733,Emily,Play hot mouth around.,2014-12-19,Christian Moore,Male,https://example.com/dogs/733.jpg
734,Michael,Show type across himself weight just beyond southern too stage.,2020-05-06,Becky Shepard MD,Female,https://example.com/dogs/734.jpg
735,Melissa,I rise cause meet with improve the which public ahead section.,2022-10-06,Joseph Blevins,Male,https://example.com/dogs/735.jpg
736,Donna,Save effect take draw also new life fact.,2011-06-11,William Griffin,Female,https://example.com/dogs/736.jpg
737,James,Generation feel rule north foreign share pick however sister.,2021-07-29,Anthony Calhoun,Female,https://example.com/dogs/737.jpg
738,Lance,Much certainly professional event you yet various health top all.,2022-07-13,Adam Martin,Male,https://example.com/dogs/738.jpg
739,Kathleen,Herself require accept sometimes somebody yet industry.,2016-11-26,James Velasquez,Female,https://example.com/dogs/739.jpg
740,Nicole,Direction require size debate house like environmental now determine.,2018-09-26,Nathaniel Williams,Male,https://example.com/dogs/740.jpg
741,Rebecca,White senior choice film step sell.,2020-06-24,Tammy Clark,Male,https://example.com/dogs/741.jpg
742,Ronald,View somebody stage last.,2023-07-26,Gregory Osborne,Male,https://example.com/dogs/742.jpg
743,Greg,Everything dinner three firm main return street candidate.,2012-03-10,Ricky Thomas,Male,https://example.com/dogs/743.jpg
744,Nicole,Beyond heavy offer stuff talk green its plant medical experience.,2010-11-05,Molly Watson,Female,https://example.com/dogs/744.jpg
745,Tyler,Experience will light wind tend.,2014-05-22,Becky Brown,Male,https://example.com/dogs/745.jpg
746,Michelle,Manager how great myself side leg represent what.,2015-07-06,Kevin Villarreal,Male,https://example.com/dogs/746.jpg
747,Phillip,Not candidate feeling still fire stock raise still smile high not.,2021-05-12,Alicia Davis,Male,https://example.com/dogs/747.jpg
748,Ryan,Hard explain produce cell old hotel second visit good thank.,2020-05-01,Crystal Morris,Male,https://example.com/dogs/748.jpg
749,Denise,Beautiful save white live enjoy a marriage.,2015-03-28,Mary Wilson,Female,https://example.com/dogs/749.jpg
750,Peter,Own now safe doctor visit rock dog policy include.,2018-03-11,Rachel Ingram,Female,https://example.com/dogs/750.jpg
751,Jessica,Raise fish baby here want son especially necessary provide.,2009-10-31,Amber Wells,Female,https://example.com/dogs/751.jpg
752,Joel,Miss rather something sing fear me.,2017-09-14,Jaclyn Padilla,Female,https://example.com/dogs/752.jpg
753,Seth,Add fund represent close vote past by.,2024-09-20,Gabrielle Holland,Female,https://example.com/dogs/753.jpg
754,Aimee,Fish a general reveal painting.,2019-07-19,Jake Johnson,Female,https://example.com/dogs/754.jpg
755,Samantha,Through effort so political happen turn reason building already college time.,2014-07-23,Margaret Williams,Female,https://example.com/dogs/755.jpg
756,Kimberly,Woman parent film note money fear.,2018-04-11,Meagan Barrett,Male,https://example.com/dogs/756.jpg
757,Kevin,Agreement authority various step your seat stop plan.,2022-07-28,James Browning,Male,https://example.com/dogs/757.jpg
758,Michael,Heart something team push general performance.,2022-06-26,Nathan Wilson,Male,https://example.com/dogs/758.jpg
759,Joanna,Perform defense just light become pressure edge floor surface.,2023-02-19,Joshua Norman,Female,https://example.com/dogs/759.jpg
760,Samuel,East whatever significant occur everyone former plant officer.,2018-11-26,Jessica Stephens,Female,https://example.com/dogs/760.jpg
761,Suzanne,Or improve site from care subject arrive seem table financial.,2021-07-09,Richard Anderson,Female,https://example.com/dogs/761.jpg
762,Ryan,Hit us one election sense require treat.,2020-04-04,Theresa Martin,Female,https://example.com/dogs/762.jpg
763,Zachary,Each room resource professor trip and almost usually arrive.,2013-05-21,Kristy Montoya,Male,https://example.com/dogs/763.jpg
764,Jamie,Activity husband notice improve quite subject.,2016-07-11,Bruce Hart,Female,https://example.com/dogs/764.jpg
765,Robert,Wear determine dark compare cold part movement go result bad turn.,2022-01-08,Thomas Johnson,Female,https://example.com/dogs/765.jpg
766,Ashley,A alone debate travel Congress activity school.,2012-04-13,James Smith,Female,https://example.com/dogs/766.jpg
767,Nicole,Long compare respond be later hold strategy exist market.,2021-04-21,Olivia Wilson,Female,https://example.com/dogs/767.jpg
768,Darius,Fund throughout foot blue one.,2012-04-18,Shawn Fox,Female,https://example.com/dogs/768.jpg
769,Michael,Ability director well water wonder task.,2011-05-08,Anthony Frye,Male,https://example.com/dogs/769.jpg
770,David,Top instead college yeah health example thing.,2013-09-01,Katherine Benjamin,Male,https://example.com/dogs/770.jpg
771,James,Ask red over manager daughter home item student.,2011-06-08,Sharon Daniels,Male,https://example.com/dogs/771.jpg
772,Jennifer,Situation decade receive office worry individual model break hand game feeling.,2010-06-03,Robert Miller,Female,https://example.com/dogs/772.jpg
773,Todd,Various send on on conference Congress fact development.,2009-11-23,Jennifer Martinez,Male,https://example.com/dogs/773.jpg
774,David,List way drug onto have.,2012-06-23,Kathryn Soto,Female,https://example.com/dogs/774.jpg
775,Susan,Rise dinner should professional same mother.,2016-12-06,Kenneth Jackson,Female,https://example.com/dogs/775.jpg
776,Timothy,Issue right film tend heavy may.,2018-06-11,Sharon Lowe,Female,https://example.com/dogs/776.jpg
777,Cynthia,Other bill without foreign it a boy society law skill.,2015-08-30,Chris Evans,Female,https://example.com/dogs/777.jpg
778,Marc,Weight serious student just how.,2016-10-13,Ellen Matthews,Female,https://example.com/dogs/778.jpg
779,Erica,Sign treat reveal girl response nor structure end.,2019-04-10,Samuel Collins,Male,https://example.com/dogs/779.jpg
780,William,For ok claim answer international eye tax tax.,2012-10-09,Sarah Cook,Female,https://example.com/dogs/780.jpg
781,Susan,Exist result after entire drive compare.,2012-12-24,Elizabeth Sanchez,Female,https://example.com/dogs/781.jpg
782,Sandy,South north return pull believe under determine whether animal chair.,2017-05-17,Lori Rodriguez,Female,https://example.com/dogs/782.jpg
783,Steven,Our be young effort boy agency.,2010-03-29,Barbara Clark,Male,https://example.com/dogs/783.jpg
784,Ian,To employee special class but.,2017-07-27,Kyle Mitchell,Female,https://example.com/dogs/784.jpg
785,Alicia,Speech ask vote court baby establish manage wish success trade country.,2021-11-21,Tristan Wheeler,Male,https://example.com/dogs/785.jpg
786,Lisa,Quite where short ten close long point.,2017-02-09,Susan Ochoa,Male,https://example.com/dogs/786.jpg
787,Keith,Century tax total so appear.,2013-09-09,Roger Reid,Female,https://example.com/dogs/787.jpg
788,Michael,Seek walk accept protect project build find.,2015-05-20,Jacob Brooks,Male,https://example.com/dogs/788.jpg
789,Charles,Social fine phone whole owner democratic force experience idea.,2012-10-25,Jonathan White,Female,https://example.com/dogs/789.jpg
790,Rhonda,Accept reveal civil provide task mind our let my.,2023-08-31,Jody Johnson,Female,https://example.com/dogs/790.jpg
791,Brittany,World work little worker quite song serious office Congress official.,2024-09-06,Jonathan Cross,Female,https://example.com/dogs/791.jpg
792,Matthew,Fact walk girl purpose boy real spend.,2015-05-14,Robert Freeman,Male,https://example.com/dogs/792.jpg
793,Brenda,Begin body new protect green reality accept improve cup Democrat rich.,2015-08-16,Joann Schneider,Male,https://example.com/dogs/793.jpg
794,Lisa,Lose state sort plan surface piece watch.,2015-04-18,David Lucas,Male,https://example.com/dogs/794.jpg
795,Raymond,Wall situation message movement indicate alone tough much spend.,2015-04-19,Miranda Parker,Male,https://example.com/dogs/795.jpg
796,Steven,Which team begin official ability morning onto join brother.,2018-07-20,Richard Davis,Female,https://example.com/dogs/796.jpg
797,Bryan,Among wonder building free general case another rock I bar glass.,2015-11-01,Rachel Rodriguez,Female,https://example.com/dogs/797.jpg
798,Brittney,Above today wrong official parent.,2014-05-29,Caleb Mayer,Female,https://example.com/dogs/798.jpg
799,Lauren,Almost tree exactly town big.,2024-02-07,Robert Thomas,Male,https://example.com/dogs/799.jpg
800,Angela,Reality town owner either.,2022-05-10,Anne Mack,Female,https://example.com/dogs/800.jpg
801,Jennifer,Forget write success thus environmental however oil population manager.,2014-09-05,Timothy Morris,Female,https://example.com/dogs/801.jpg
802,Lawrence,Already sit later method partner.,2017-01-10,Brandi King,Male,https://example.com/dogs/802.jpg
803,Jennifer,Economic body probably country analysis.,2018-08-05,Angela Lara,Female,https://example.com/dogs/803.jpg
804,Michael,Deep own recognize already east.,2021-02-19,Jordan Patrick,Female,https://example.com/dogs/804.jpg
805,Blake,Market near both drug.,2021-09-09,Jessica Bates,Female,https://example.com/dogs/805.jpg
806,Kristen,Number leg through see sing will.,2019-07-17,Russell Hansen DVM,Female,https://example.com/dogs/806.jpg
807,Michael,Either hotel quickly gun.,2018-05-29,Kenneth Mcdonald,Male,https://example.com/dogs/807.jpg
808,Christopher,Wear be relationship sea young.,2010-08-08,Tracy Koch,Male,https://example.com/dogs/808.jpg
809,Andrea,Away defense drop enough answer.,2011-01-10,Edward Coleman,Female,https://example.com/dogs/809.jpg
810,David,Poor pay partner catch process heart mean natural.,2021-05-13,Deborah Hood,Male,https://example.com/dogs/810.jpg
811,Adrian,Water east them probably bad else prepare nation.,2010-09-06,Brandy Hodges PhD,Male,https://example.com/dogs/811.jpg
812,Stephanie,Western six travel bed sport guy buy Democrat value.,2019-04-28,Tracy Hicks,Female,https://example.com/dogs/812.jpg
813,Jamie,Physical discussion like service many one benefit step compare.,2014-09-07,Seth Guzman,Female,https://example.com/dogs/813.jpg
814,Vanessa,Bank election about half little sort song maybe.,2021-02-19,Juan Hunt,Male,https://example.com/dogs/814.jpg
815,Emily,Imagine total gun establish new now magazine whether.,2013-10-30,Justin Mccullough,Male,https://example.com/dogs/815.jpg
816,Rachel,Force teacher stay claim.,2016-05-25,Joshua Atkinson,Female,https://example.com/dogs/816.jpg
817,Kristin,Information them number activity process.,2022-04-17,Joseph Brewer,Male,https://example.com/dogs/817.jpg
818,Maria,Public glass measure necessary when idea guy bank.,2023-10-29,Maria Hubbard,Female,https://example.com/dogs/818.jpg
819,Allen,Pressure total doctor dog eye he list mean.,2023-03-15,Julie Moody,Female,https://example.com/dogs/819.jpg
820,Bryan,Probably crime writer church behind common most thing position quality toward.,2021-04-06,Robin Lopez,Male,https://example.com/dogs/820.jpg
821,Craig,Back nation final mother response interview sea which pattern.,2021-11-11,Dennis Brown,Female,https://example.com/dogs/821.jpg
822,Stephanie,Successful use also memory bring organization star.,2016-09-05,James Ward,Female,https://example.com/dogs/822.jpg
823,Anthony,Else there something matter there offer occur.,2011-08-06,Morgan Gutierrez,Female,https://example.com/dogs/823.jpg
824,Stephanie,Ground their beat else country.,2014-04-27,Brian Fletcher,Female,https://example.com/dogs/824.jpg
825,Alejandro,Well each degree believe partner.,2012-10-24,Lisa Brewer,Male,https://example.com/dogs/825.jpg
826,Ross,Pick how machine network.,2017-01-09,Elizabeth Davidson,Female,https://example.com/dogs/826.jpg
827,Harold,Those business total scientist world book.,2018-01-08,Ashley James,Male,https://example.com/dogs/827.jpg
828,Christian,Not big sport moment when green wear wide above.,2019-08-02,Daniel Day,Female,https://example.com/dogs/828.jpg
829,Nicole,Pm rather hour simple particularly responsibility day much.,2015-03-22,Glenn Griffin,Female,https://example.com/dogs/829.jpg
830,Ryan,Respond eye indicate long general.,2017-09-24,Alexandra Beck,Female,https://example.com/dogs/830.jpg
831,Catherine,Again dog never consumer let government young sense suddenly claim.,2015-01-18,Christopher Sanchez,Male,https://example.com/dogs/831.jpg
