id,name,description,dob,owner,gender,image
1,Brandon,Air across report increase truth strategy newspaper relationship.,2022-08-31,Anthony Murray,Female,https://example.com/dogs/1.jpg
2,Marco,Former someone leave from but.,2020-11-12,Samantha Webster,Female,https://example.com/dogs/2.jpg
3,Rose,Vote middle former deep kid total current oil.,2019-05-11,Kristina Huynh,Female,https://example.com/dogs/3.jpg
4,Christopher,Dinner lot walk member case begin star blue letter.,2012-06-26,Laura Wong,Male,https://example.com/dogs/4.jpg
5,Henry,Own total remain maintain compare area.,2019-07-07,Timothy Wilson,Female,https://example.com/dogs/5.jpg
6,Adam,Front sense experience product land wish.,2012-07-15,Andrea Smith,Male,https://example.com/dogs/6.jpg
7,Erin,Should marriage different security ago activity surface party staff specific.,2018-12-15,Antonio Leon,Male,https://example.com/dogs/7.jpg
8,Daniel,Position test four health Democrat check list purpose fall ball.,2013-05-23,David Fisher,Male,https://example.com/dogs/8.jpg
9,Nicole,Campaign like those here nature college home way crime although.,2011-07-11,Kevin Lopez,Male,https://example.com/dogs/9.jpg
10,Jeffrey,Charge despite option politics break power throw sing game.,2013-03-27,Michael Williams,Female,https://example.com/dogs/10.jpg
11,Tammy,Character apply employee benefit memory six decide low bed after right.,2011-01-21,Victoria Stout,Female,https://example.com/dogs/11.jpg
12,Brian,Without but would fish direction.,2014-10-19,Samuel Quinn,Male,https://example.com/dogs/12.jpg
13,Felicia,Model measure site research lead one shake night.,2017-07-05,Barbara Hubbard,Female,https://example.com/dogs/13.jpg
14,Rachel,Last voice fly wife hold work offer city west blue.,2021-08-27,Hailey Davis,Male,https://example.com/dogs/14.jpg
15,John,Reflect fight experience contain ability.,2010-07-26,Steven Barnes,Female,https://example.com/dogs/15.jpg
16,Benjamin,Responsibility city then issue degree.,2013-05-10,Ruth Marshall,Female,https://example.com/dogs/16.jpg
17,Henry,Certain someone politics piece take easy rest.,2018-11-05,Diana Blevins,Male,https://example.com/dogs/17.jpg
18,David,Country reach agree entire.,2022-05-11,Rachel Donaldson,Female,https://example.com/dogs/18.jpg
19,Alicia,Per require thus shake firm.,2016-06-29,Douglas Erickson Jr.,Male,https://example.com/dogs/19.jpg
20,Teresa,Catch author take newspaper spring move American wife.,2018-02-11,Holly Morgan,Female,https://example.com/dogs/20.jpg
21,Michelle,Note tax believe his same my task stop feeling.,2021-01-24,Ronald Parsons,Male,https://example.com/dogs/21.jpg
22,Benjamin,Plan option no radio apply case fire medical religious total.,2017-09-29,Robert James,Female,https://example.com/dogs/22.jpg
23,Jason,Marriage type oil seek happen and detail until model she.,2017-12-24,Jonathan Bowen,Male,https://example.com/dogs/23.jpg
24,Jeffrey,Deep cup condition feeling drug agree clearly specific baby body.,2022-12-14,Lindsay Byrd,Male,https://example.com/dogs/24.jpg
25,Amy,Through that theory team decade do quickly behavior.,2020-05-31,Kyle Kramer,Female,https://example.com/dogs/25.jpg
26,Kaylee,Traditional trip imagine point north trip they.,2013-12-13,Matthew Dunn,Male,https://example.com/dogs/26.jpg
27,Catherine,Article marriage relationship street see our yard.,2017-10-26,Christopher Wright,Female,https://example.com/dogs/27.jpg
28,Amber,Rise send recognize wrong husband garden.,2016-12-12,Brian Dominguez,Male,https://example.com/dogs/28.jpg
29,Alexandra,Public line charge might white interview especially choose whole.,2021-10-15,Monique White,Female,https://example.com/dogs/29.jpg
30,Randy,Interview couple himself want light subject.,2015-11-13,Isaiah Le,Female,https://example.com/dogs/30.jpg
31,Alison,So believe art upon.,2020-08-31,Kathleen Santiago,Female,https://example.com/dogs/31.jpg
32,Matthew,Reality mean responsibility red test onto movement building.,2018-09-20,Sarah Reed,Female,https://example.com/dogs/32.jpg
33,Sonya,Condition develop smile born face simply organization always race.,2014-11-04,Victoria Villarreal,Female,https://example.com/dogs/33.jpg
34,Jason,Social son join music happen response improve become bill.,2021-02-07,Lisa Christian,Female,https://example.com/dogs/34.jpg
35,Jason,Son ready deal end role item never since wrong rock.,2020-01-19,Elizabeth Brock,Male,https://example.com/dogs/35.jpg
36,Carmen,More several animal low sound indeed value.,2021-02-24,Amy Jarvis,Male,https://example.com/dogs/36.jpg
37,Christine,It type woman that station much movement.,2019-02-22,Christopher Crawford,Male,https://example.com/dogs/37.jpg
38,James,Entire less door let peace guy student executive role.,2018-08-31,Phillip Martin,Female,https://example.com/dogs/38.jpg
39,Jeffrey,Enjoy again easy notice next economic beat.,2013-07-05,Katie Baker,Male,https://example.com/dogs/39.jpg
40,Frederick,Style hear campaign positive change apply network small.,2011-10-11,Jill Joyce,Male,https://example.com/dogs/40.jpg
41,Michael,Good performance quality federal take central bring case anyone.,2021-05-27,Brenda Stone,Male,https://example.com/dogs/41.jpg
42,Joshua,Reason executive amount view drop kitchen trade.,2012-10-19,Claire Richardson,Male,https://example.com/dogs/42.jpg
43,Jennifer,Him way probably pretty can than eight west especially.,2017-04-20,Gabriela Martinez,Female,https://example.com/dogs/43.jpg
44,Susan,Coach since eight pay.,2022-03-28,Jesus Kelley,Male,https://example.com/dogs/44.jpg
45,Carolyn,Understand treatment look style consumer live risk measure.,2021-05-25,Melissa Taylor,Female,https://example.com/dogs/45.jpg
46,Andrew,Six body little current sister executive would room present.,2020-06-11,Kyle Sims,Female,https://example.com/dogs/46.jpg
47,Rachel,Finally stop big information enough teach training.,2019-02-07,Angela Fowler,Male,https://example.com/dogs/47.jpg
48,Julie,Notice open present sell market.,2012-11-26,Melissa Martin,Male,https://example.com/dogs/48.jpg
49,Shelley,Wrong walk few white challenge glass idea country.,2019-08-17,Robert Perkins,Male,https://example.com/dogs/49.jpg
50,Kimberly,Land last customer window organization describe painting value.,2011-04-16,Patricia Simon,Male,https://example.com/dogs/50.jpg
51,Claudia,Role identify long would lose site apply.,2015-05-15,Diane Johnson,Female,https://example.com/dogs/51.jpg
52,Jamie,Draw save view close authority threat else.,2020-07-12,David Young,Male,https://example.com/dogs/52.jpg
53,Tara,Control election themselves finish see.,2016-10-12,Sharon Jones,Female,https://example.com/dogs/53.jpg
54,Michael,Small figure civil for again one church story race.,2020-12-27,Robert Fisher,Female,https://example.com/dogs/54.jpg
55,Cameron,Interest manage particular theory right hundred.,2009-11-07,John Robbins,Female,https://example.com/dogs/55.jpg
56,Ashley,Item music enjoy us thought later.,2023-12-07,Amy Collins,Female,https://example.com/dogs/56.jpg
57,Alex,Like spend large southern cause sister lawyer should.,2014-02-03,Michelle Reed,Female,https://example.com/dogs/57.jpg
58,Stacy,Born figure generation woman old director history.,2019-01-08,Bryan Thomas,Female,https://example.com/dogs/58.jpg
59,Laura,Successful building answer study who goal with prove long enter.,2019-04-24,Sandra Howard,Female,https://example.com/dogs/59.jpg
60,Madison,Cause war that wish him box dark song.,2022-04-30,Joseph Waters,Female,https://example.com/dogs/60.jpg
61,John,Item mother them center account.,2015-06-06,Jonathan Mccall,Female,https://example.com/dogs/61.jpg
62,Timothy,Popular today media town low organization and sport.,2021-01-07,Rebecca Bass,Female,https://example.com/dogs/62.jpg
63,Jimmy,Member all teacher war recognize executive building suggest politics state.,2021-07-15,Marcus Campbell,Male,https://example.com/dogs/63.jpg
64,John,Bank write history throughout nor.,2022-03-31,Nicholas Martinez,Male,https://example.com/dogs/64.jpg
65,Jonathan,Ready call nor right.,2023-05-14,Brittany Rice,Male,https://example.com/dogs/65.jpg
66,William,Over agency cover particular open coach.,2010-02-23,Jose Morgan,Female,https://example.com/dogs/66.jpg
67,Timothy,Camera stay rest where son myself network indeed expect low.,2013-08-15,Willie Brown,Male,https://example.com/dogs/67.jpg
68,Christopher,Minute hand must medical difference.,2021-02-01,Carl Hess,Male,https://example.com/dogs/68.jpg
69,Diana,General there arrive result after level.,2010-01-19,Shirley Thomas,Female,https://example.com/dogs/69.jpg
70,Linda,Various official news piece near let note well.,2016-12-14,Christopher Ross,Female,https://example.com/dogs/70.jpg
71,Jose,Nearly report free trouble cultural brother report environmental nor night.,2018-11-09,Linda Dudley,Female,https://example.com/dogs/71.jpg
72,Mark,Worker process others blood expect role in.,2014-01-22,Jeff Snyder,Male,https://example.com/dogs/72.jpg
73,Charles,Whom station day dog throw power try per.,2018-12-13,Lisa Young,Male,https://example.com/dogs/73.jpg
74,Patrick,Matter book thank air industry beyond use.,2010-10-04,Charles Nelson,Female,https://example.com/dogs/74.jpg
75,Donna,Service he environment although draw office she.,2017-10-29,Allison Jordan,Male,https://example.com/dogs/75.jpg
76,Edward,Concern today under how identify environmental entire then.,2022-02-12,Kevin Jackson,Female,https://example.com/dogs/76.jpg
77,Amy,Firm technology little new serious story agent nor.,2019-12-26,Martin Castillo Jr.,Female,https://example.com/dogs/77.jpg
78,Bradley,Age around learn behavior Republican whatever would.,2012-01-30,Bryan Lopez,Female,https://example.com/dogs/78.jpg
79,Katelyn,White buy add night fall open big vote.,2019-06-17,Ernest Myers,Female,https://example.com/dogs/79.jpg
80,Julia,Evening save that reduce will.,2013-11-21,Lauren Rosario,Male,https://example.com/dogs/80.jpg
81,Brandi,Fact respond church state water.,2012-10-12,Patricia Roach,Female,https://example.com/dogs/81.jpg
82,Joseph,Deep article service nation fall generation.,2019-12-08,John Key,Female,https://example.com/dogs/82.jpg
83,Ronald,Group walk can politics industry run important.,2010-02-27,Joseph Lopez,Male,https://example.com/dogs/83.jpg
84,Kelly,Ready lose politics avoid reality reason together blue might result.,2020-11-24,William Bautista,Female,https://example.com/dogs/84.jpg
85,Mitchell,First middle four between market choice condition community current choice fact.,2012-09-22,David Flowers,Male,https://example.com/dogs/85.jpg
86,Marissa,Point interesting his network sister fight his movie all.,2021-07-19,Hannah Long,Female,https://example.com/dogs/86.jpg
87,Paul,How instead foreign network sport pass economic.,2023-10-19,Michael Duffy,Female,https://example.com/dogs/87.jpg
88,Joshua,Test green me science camera method.,2019-08-26,Lindsey Payne,Female,https://example.com/dogs/88.jpg
89,Cory,Black carry former western during traditional news who clearly.,2023-02-23,Jill Ramos,Female,https://example.com/dogs/89.jpg
90,Raymond,Lawyer low partner identify over blue bit statement scientist.,2016-01-05,Joanna Martin,Female,https://example.com/dogs/90.jpg
91,Donna,Military happy no learn at rule different.,2018-10-26,Tommy Cohen,Female,https://example.com/dogs/91.jpg
92,Melissa,Security how without name personal customer perhaps.,2023-04-03,Christopher Jackson,Male,https://example.com/dogs/92.jpg
93,Allison,Develop board drug national between open project.,2019-12-26,Lindsay Roberts,Female,https://example.com/dogs/93.jpg
94,Logan,Economy thus send opportunity yourself plan traditional himself age exactly.,2020-03-11,Ronald Stevens,Female,https://example.com/dogs/94.jpg
95,Carolyn,Husband food reason already great baby plant child foot sign.,2015-10-27,Jennifer Curry,Female,https://example.com/dogs/95.jpg
96,Oscar,Town herself perhaps physical first.,2011-11-06,Savannah Harvey,Male,https://example.com/dogs/96.jpg
97,Edward,Certainly city soon window assume.,2019-06-05,Danielle Aguilar,Male,https://example.com/dogs/97.jpg
98,Alexandra,Must nothing hold sometimes six mind voice several responsibility.,2022-01-05,Wesley Friedman,Male,https://example.com/dogs/98.jpg
99,Renee,Wide small each certain discover newspaper church similar follow.,2024-06-27,Anthony Horton,Male,https://example.com/dogs/99.jpg
100,Sharon,Product seek talk lay music long window sing factor level.,2014-09-17,Donna Moreno,Female,https://example.com/dogs/100.jpg
101,Tiffany,Pretty involve my positive window TV teacher sit almost marriage rule.,2013-03-02,James Taylor,Female,https://example.com/dogs/101.jpg
102,Brian,Begin use statement reflect far artist vote accept paper.,2021-05-04,Ryan Evans,Female,https://example.com/dogs/102.jpg
103,Emily,Risk feel these our.,2019-06-01,Juan Rowland,Male,https://example.com/dogs/103.jpg
104,Earl,Provide thought establish appear PM alone.,2017-12-23,Cameron Ross,Female,https://example.com/dogs/104.jpg
105,Samantha,Huge miss debate ten play stock be no money he.,2011-11-07,Roberta Gilbert,Male,https://example.com/dogs/105.jpg
106,Duane,General level join name reveal argue north example.,2011-07-02,Michele Carrillo,Male,https://example.com/dogs/106.jpg
107,Maria,Information place collection dinner it form player campaign feeling strong.,2015-01-30,Mario Lindsey,Male,https://example.com/dogs/107.jpg
108,Amy,Past her could skin movie me long together serious.,2018-09-22,Jennifer Hernandez,Male,https://example.com/dogs/108.jpg
109,Cameron,Whom get detail short everybody field wear possible.,2010-08-29,James Mcclure,Male,https://example.com/dogs/109.jpg
110,Michael,Keep be none store something yourself finally.,2019-12-02,Laura Anderson,Male,https://example.com/dogs/110.jpg
111,Tina,Off me its form south half.,2014-03-07,Kevin Campbell,Female,https://example.com/dogs/111.jpg
112,Linda,Customer market yard cover around computer study friend official.,2020-11-16,Sandra Joseph,Male,https://example.com/dogs/112.jpg
113,Ashley,Bring eat record design near team.,2011-04-23,Laura Clark,Male,https://example.com/dogs/113.jpg
114,Daniel,Sea cut finally ago relate cost real.,2013-08-04,Allen Sawyer,Male,https://example.com/dogs/114.jpg
115,Richard,Green like perform message population.,2014-05-05,Darren Griffin,Female,https://example.com/dogs/115.jpg
116,Donald,Local face ahead become entire almost.,2024-05-17,Nancy Davis,Male,https://example.com/dogs/116.jpg
117,Michael,Board everyone if ask example avoid around each.,2012-04-05,Phyllis Lucas,Female,https://example.com/dogs/117.jpg
118,Eric,Daughter where western generation.,2021-05-07,Sandra White,Female,https://example.com/dogs/118.jpg
119,Kimberly,Voice history indicate wrong nice trouble sell citizen.,2015-04-24,Jamie Bell,Female,https://example.com/dogs/119.jpg
120,Jennifer,Institution certainly arm official consider article believe only.,2018-09-15,William Perez,Male,https://example.com/dogs/120.jpg
121,Christine,Bag spend within if month owner spend.,2019-12-11,Paula Rodriguez,Male,https://example.com/dogs/121.jpg
122,Robert,Baby describe especially including style bar.,2009-12-22,Andrew Wilson,Male,https://example.com/dogs/122.jpg
123,Manuel,Moment his do can PM red stage.,2018-11-05,Steven Rodriguez,Female,https://example.com/dogs/123.jpg
124,Shawn,Once end rest car page on campaign action.,2021-06-02,Eric Rivas Jr.,Male,https://example.com/dogs/124.jpg
125,Sherri,Tough politics suffer along stock discussion nothing.,2012-08-27,Robert Price,Female,https://example.com/dogs/125.jpg
126,Michael,Loss interest drive fly join chair during again yes.,2015-09-28,Clifford Pope,Male,https://example.com/dogs/126.jpg
127,Michael,Coach strategy news magazine shake expect police.,2019-08-08,Joseph Mitchell,Female,https://example.com/dogs/127.jpg
128,Briana,Art scientist significant strategy order matter should.,2019-06-10,Gregory Reyes,Male,https://example.com/dogs/128.jpg
129,Mark,Phone start run parent notice three national last position fire.,2016-12-05,Ronald Dawson,Male,https://example.com/dogs/129.jpg
130,Stephen,Especially answer only east bed.,2017-12-07,Donald Vasquez,Male,https://example.com/dogs/130.jpg
131,Luke,Significant go short however radio.,2012-07-04,James Gonzales,Male,https://example.com/dogs/131.jpg
132,Bethany,Create four who great us represent affect which where wait shake.,2022-05-18,Melanie Walker,Female,https://example.com/dogs/132.jpg
133,Antonio,Whole couple adult occur open watch involve down.,2014-10-11,Brianna Adams,Female,https://example.com/dogs/133.jpg
134,Brittany,Throughout along loss consider myself company live.,2013-02-26,Stephanie Williams MD,Male,https://example.com/dogs/134.jpg
135,Toni,Mind area certainly fly year guess country.,2019-04-14,Jonathan Mitchell,Female,https://example.com/dogs/135.jpg
136,Savannah,Week effect record born early recently claim teach.,2012-08-23,Lisa Franklin,Female,https://example.com/dogs/136.jpg
137,Elizabeth,Southern beat building claim pay speak them character.,2019-11-08,Patricia Lopez,Female,https://example.com/dogs/137.jpg
138,Virginia,Message find fill rich tough remain member use.,2024-05-16,Anna Barber,Male,https://example.com/dogs/138.jpg
139,Meagan,Real ahead for few huge fill few.,2011-10-08,Travis Mendoza,Female,https://example.com/dogs/139.jpg
140,Vicki,Onto similar whatever suffer stay matter car.,2015-11-25,Kristy Miller,Male,https://example.com/dogs/140.jpg
141,Jackie,Yourself feel face view tough magazine rich staff stage.,2013-05-03,Crystal Burgess,Female,https://example.com/dogs/141.jpg
142,Lance,Whom their deep exist scene civil summer lot necessary though.,2018-02-19,Joseph Graham,Male,https://example.com/dogs/142.jpg
143,Jimmy,Brother long store list should.,2012-11-30,Kathryn Perry,Female,https://example.com/dogs/143.jpg
144,Anna,Cost score training boy ability teacher ever card young.,2016-07-02,Marcus Phelps,Female,https://example.com/dogs/144.jpg
145,Daniel,Such her than must doctor pressure.,2011-10-04,Diane Williams,Female,https://example.com/dogs/145.jpg
146,Allison,Way authority situation including focus.,2019-08-08,Mrs. Andrea Gutierrez,Male,https://example.com/dogs/146.jpg
147,Michael,Mr language TV fly number apply create return newspaper expert.,2021-12-22,Julia Brooks,Female,https://example.com/dogs/147.jpg
148,Breanna,Present investment set save environment drug amount star.,2019-07-31,Elizabeth Smith,Female,https://example.com/dogs/148.jpg
149,Hector,Hard red recently themselves history down require evening law attorney.,2011-11-04,Karen Palmer,Female,https://example.com/dogs/149.jpg
150,William,Investment same approach follow cover federal need.,2018-06-14,Sarah Barrett,Male,https://example.com/dogs/150.jpg
151,Deborah,Like respond build effect return.,2020-04-20,Kevin Gordon,Male,https://example.com/dogs/151.jpg
152,Michelle,Religious interesting cultural reason religious technology plan.,2022-11-25,Kathy Williams,Male,https://example.com/dogs/152.jpg
153,Joy,Remain material ability recent rule from until school inside know.,2021-04-17,Randy Velazquez,Male,https://example.com/dogs/153.jpg
154,Jacob,Star reason buy able road.,2023-07-27,Anthony Powell,Male,https://example.com/dogs/154.jpg
155,Lynn,Detail close catch fast each force again guy.,2011-02-25,Angela Pennington,Female,https://example.com/dogs/155.jpg
156,Danielle,Role within could land place billion would western.,2010-05-16,Samuel Smith,Male,https://example.com/dogs/156.jpg
157,Karen,Quite also prepare east organization.,2022-03-07,Rachael Johnson,Male,https://example.com/dogs/157.jpg
158,Ryan,Accept enjoy probably tell paper rather establish air.,2016-08-19,Lauren Hernandez,Male,https://example.com/dogs/158.jpg
159,Alyssa,Common help oil nothing south road feeling low.,2011-10-02,Rebecca Miller,Male,https://example.com/dogs/159.jpg
160,Michelle,Partner street watch energy nation measure.,2019-08-02,Jamie Walsh,Male,https://example.com/dogs/160.jpg
161,Scott,House huge future step involve his car finally my.,2015-09-03,Brittany Hall,Male,https://example.com/dogs/161.jpg
162,Michael,Green indicate quite its follow.,2018-11-18,Carol Jackson,Female,https://example.com/dogs/162.jpg
163,Sandra,Top certain language hit Mr week forget foot fill.,2012-09-18,Joy Walton,Female,https://example.com/dogs/163.jpg
164,Matthew,Tv job tonight easy father.,2013-09-21,Kristen Thomas,Female,https://example.com/dogs/164.jpg
165,Susan,Science learn never share keep.,2021-10-04,Chad Nguyen,Male,https://example.com/dogs/165.jpg
166,Andrew,Wish large remember news discuss.,2018-08-21,Casey Young,Male,https://example.com/dogs/166.jpg
167,Daisy,Campaign Mr protect these property goal lead.,2020-04-11,Ashley Williams,Male,https://example.com/dogs/167.jpg
168,Beth,Final get message pretty show choose reveal single explain.,2014-06-13,Travis Garner,Male,https://example.com/dogs/168.jpg
169,Patricia,Add way once chance loss there approach sit.,2011-07-08,Courtney Wright,Male,https://example.com/dogs/169.jpg
170,Shelly,Out material whom direction sound.,2024-03-08,Kristin Vasquez,Female,https://example.com/dogs/170.jpg
171,Jeffrey,Project force wish drive face.,2023-01-07,Jose Cameron,Male,https://example.com/dogs/171.jpg
172,Carl,Listen card system quality again pick southern.,2014-08-06,John Khan,Female,https://example.com/dogs/172.jpg
173,Sonya,Consumer east stand teacher to.,2024-04-29,Patricia Moore,Male,https://example.com/dogs/173.jpg
174,Nathan,Report discover field party job image simply before notice.,2021-07-09,Taylor Gray,Male,https://example.com/dogs/174.jpg
175,Billy,Arm box world care share message miss focus.,2011-03-13,Mrs. Tina Taylor PhD,Female,https://example.com/dogs/175.jpg
176,Amy,Design minute level occur leave alone per first.,2013-05-07,Jermaine Barnett,Female,https://example.com/dogs/176.jpg
177,William,Exist feeling every should us around pattern.,2019-01-19,Brittney Colon,Male,https://example.com/dogs/177.jpg
178,Ashley,Another point wish large animal win almost.,2009-12-15,Rebecca Shelton,Male,https://example.com/dogs/178.jpg
179,John,Million situation explain moment exactly.,2012-11-11,Tracy Haynes,Male,https://example.com/dogs/179.jpg
180,Kimberly,Morning me story might series.,2015-10-24,Laura Martinez,Female,https://example.com/dogs/180.jpg
181,Luis,Center form new national build suddenly.,2014-12-12,Nathaniel Wong,Male,https://example.com/dogs/181.jpg
182,Jason,Month woman once grow animal billion least imagine.,2012-07-04,Katelyn Peterson,Female,https://example.com/dogs/182.jpg
183,Angela,Actually talk system show style movement put they.,2014-08-06,Jason Turner,Female,https://example.com/dogs/183.jpg
184,Ashley,Name least usually official help civil.,2015-05-26,Carla Woods,Female,https://example.com/dogs/184.jpg
185,Stefanie,Relate believe remain themselves party because.,2024-04-29,Kristin Ortega,Male,https://example.com/dogs/185.jpg
186,Matthew,Person old north wear ahead word nearly exist south.,2017-08-20,Tyrone Johnson,Female,https://example.com/dogs/186.jpg
187,Sandra,Such peace summer learn game forget civil air west.,2016-05-23,Catherine Mcknight,Male,https://example.com/dogs/187.jpg
188,Richard,Central help lot teacher such size office face avoid use.,2018-08-20,Stephanie Gallagher,Male,https://example.com/dogs/188.jpg
189,Rebecca,Standard reveal line could east.,2018-07-28,Jennifer Mcclain,Male,https://example.com/dogs/189.jpg
190,Travis,Anyone during artist personal case decision southern six.,2014-09-25,Steven Schroeder,Female,https://example.com/dogs/190.jpg
191,Gabriela,East because discuss big between available.,2017-05-23,Bryan Mann,Female,https://example.com/dogs/191.jpg
192,Diana,Threat government media cover food.,2012-08-01,Kelly Salas,Male,https://example.com/dogs/192.jpg
193,Corey,Second husband soon reason red smile environmental.,2024-02-05,Shannon Eaton,Female,https://example.com/dogs/193.jpg
194,Dustin,Lawyer say top particularly tough pass live debate truth.,2017-01-17,Jamie Munoz,Male,https://example.com/dogs/194.jpg
195,Ashley,Send recognize on energy reason very.,2019-05-10,Mary Wong,Male,https://example.com/dogs/195.jpg
196,Robin,But art give shake break morning radio world daughter.,2019-01-26,Thomas Bell,Female,https://example.com/dogs/196.jpg
197,Joel,Sort seat so senior build so poor street base value.,2020-11-24,Mark Bell,Female,https://example.com/dogs/197.jpg
198,Jennifer,Listen water member war modern determine until change everybody.,2010-06-17,John Hernandez,Male,https://example.com/dogs/198.jpg
199,Ryan,Number likely politics argue itself.,2016-03-05,Kelly Hood,Male,https://example.com/dogs/199.jpg
200,Donald,Keep order simply despite we chance already smile theory.,2022-02-25,Mark Evans,Male,https://example.com/dogs/200.jpg
201,Mary,Prevent evidence mention design various would rest push surface forward.,2010-10-15,Gina Gardner,Male,https://example.com/dogs/201.jpg
202,Ashley,Away race central kind activity late.,2011-02-03,Charles Marshall,Female,https://example.com/dogs/202.jpg
203,Michael,Speak lot movie weight attention generation education bank threat technology.,2019-04-20,Jacob Johnston,Female,https://example.com/dogs/203.jpg
204,Michelle,Staff take relationship season agree concern easy himself.,2010-12-12,Anna Garrett,Male,https://example.com/dogs/204.jpg
205,Michael,Sister region go station ever themselves for hotel perform.,2012-10-03,Daniel Hill,Female,https://example.com/dogs/205.jpg
206,Sean,Employee Republican model experience company wish commercial society.,2017-03-22,Christina James,Male,https://example.com/dogs/206.jpg
207,Katherine,Fine production she mind must section alone.,2017-11-18,Elizabeth May,Female,https://example.com/dogs/207.jpg
208,Gina,Second cause child early sense Democrat program.,2011-12-02,Patrick Pacheco,Male,https://example.com/dogs/208.jpg
209,Harold,Someone evening decide surface ahead bad dream.,2014-03-02,William Meyer,Female,https://example.com/dogs/209.jpg
